Web Series Name,Original Language - Year of Release,Episodes,Overview,MDL Rating
ZeroBaseOne Debut Show: In Bloom,Korean TV Show - 2023,1 episodes,"The debut show of the K-pop boy group ZEROBASEONE.

(Source: MyDramaList)",8.6
NCT DREAM X Our Night,Korean TV Show - 2019,1 episodes,"Our Night is like a mafia game where everyone will be in one room.
This episode: NCT DREAM",8.5
JSMR,Korean TV Show - 2019,12 episodes,Overview not available,8.6
MONSTA X Dingo School,Korean TV Show - 2020,6 episodes,Overview not available,8.6
One Good Lemonade for One Good Talk,Korean TV Show - 2021,1 episodes,Overview not available,8.6
Gol-Cha's Holiday Season 2,Korean TV Show - 2018,4 episodes,Golden Child on a day off from their busy IDOL life,8.6
THE BOYZ Star Online Lecture,Korean TV Show - 2019,8 episodes,In New Term! Crash Course to be Hip in 3 Minutes,8.6
"CT High School - Grade 1, Class 27",Korean TV Show - 2021,3 episodes,"CT High School Grade 1, Class 27 is a reality show starring the members of NCT 127. It is a series following the high school students of CT High School Grade 1, Class 27.

(Source: NCT Wiki Fandom)",8.6
DOLympiad THE BOYZ,Korean TV Show - 2020,4 episodes,Overview not available,8.6
GOT7's Starcast: Hard Carry,Korean TV Show - 2016,2 episodes,Watch GOT7 as they prepare for concerts and fan-meetings.,8.6
The 100 Season 3,Korean TV Show - 2018,24 episodes,"Follows a 100 hours of the daily lives of ""IMFACT"" boy group as they preparing a mini concert for their fans.",8.6
Monsta X Hidden Track No.V,Korean TV Show - 2019,2 episodes,Overview not available,8.4
GOT7 Weekly Diary,Korean TV Show - 2015,4 episodes,"K-pop boy group GOT7 documents their activities weekly throughout the month of October, 2015.",8.6
KAIst,Korean TV Show - 2021,7 episodes,"KAI proves to be quite the renaissance man as he announces his debut as a YouTuber now. KAIst stands for ""KAI"" or Jongin's stage name, and ""st"" stands for style, which means ""KAI STYLE,"" where he can put various types…",8.6
Inssa Oppa Season 7,Korean TV Show - 2022,9 episodes,Overview not available,8.6
Let’s Walk Together,Korean TV Show - 2018,10 episodes,"The five members of the K-pop idol group g.o.d travels to Spain to walk El Camino de Santiago together.

(Source: DramaWiki)",8.6
Treasure: Find Your Korea,Korean TV Show - 2021,5 episodes,"The members from Treasure will have a project called “Find Your Korea” where they will showcase and give you a tour of some of the wonderful places to go to around Korea!

(Source: Twitter)",8.6
B.A.P Untact Life,Korean TV Show - 2018,4 episodes,"K-pop boy band B.A.P go “untact” and spend 4 days on the remote south Korean island of Nodo. With no mobile phone and limited connection to the outside world, Yongguk, Himchan, Daehyun, Youngjae, Jongup and Zelo…",8.6
Jus2 Tourgraph:  'Focus' Premiere Showcase Tour,Korean TV Show - 2019,4 episodes,Overview not available,8.6
"Our, July",Korean TV Show - 2021,2 episodes,NCT 127 celebrates their 5th anniversary.,8.6
Fill It Up,Korean TV Show - 2022,5 episodes,"The members of NCT 127 goes on an outing to recharge their energy ahead of their comeback with ""2 Baddies"". They make their own schedule of what they would like to do, such as playing games, sing karaoke and spend time…",8.6
N.Flying Seunghyub's Summer Camp Season 4,Korean TV Show - 2021,4 episodes,Season 4 of Seunghyub's summer camp.,8.5
NCT127 X LieV,Korean TV Show - 2018,1 episodes,Overview not available,8.6
The Boyz the Blood: Death Match,Korean TV Show - 2021,10 episodes,"The Boyz are the noble vampires of the Creker planet. But one day, the Wolf which spreads mutation virus has come to the planet and therefore, they enter an emergency crisis. How will The Boyz respond? (Source: Universe…",8.5
Idol Workshop: Golden Child,Korean TV Show - 2020,5 episodes,Overview not available,8.6
Eunhyuk's Clothing,Korean TV Show - 2020,20 episodes,Eunhyuk will host a fashion content show through a NAVER channel,8.6
"ITZY ""Loco"" BEHIND",Korean TV Show - 2021,12 episodes,Behind the scenes of Itzy's Loco MV filming.,8.5
Clean Cam,Korean TV Show - 2020,91 episodes,Overview not available,8.6
Nice to Meet You! IZ*ONE’s First Steps in Japan,Japanese TV Show - 2019,2 episodes,Overview not available,8.6
Find the Best Cowboy,Korean TV Show - 2021,2 episodes,Overview not available,8.6
ASTRO Amigo TV,Korean TV Show - 2018,3 episodes,Overview not available,8.6
Gfriend! Look After Our Dog,Korean TV Show - 2015,12 episodes,/,8.6
Pentagon - Just Do It Yo!,Korean TV Show - 2018,24 episodes,Overview not available,8.6
IdolStein: TREASURE,Korean TV Show - 2022,2 episodes,"ACL Studio's idol variety series available on YouTube, featuring boy group TREASURE!

(Source: MyDramaList)",8.4
A Journey for No.1,Chinese TV Show - 2023,5 episodes,"No. 1 Seniors take No. 2 Little Rabbit on an adventure following a geography book that takes them to Yunnan where they go to scenic destinations, partake in arts and crafts and try speciality dishes. (Source: Chinese…",8.4
Welcome to NCT’s Horror Nights,Korean TV Show - 2021,2 episodes,"A show where some members from NCT 127, NCT DREAM, and NCT U read horror stories sent by fans. 
(Source: foxyjo on MDL)",8.6
Ssap-Dance: Astro,Korean TV Show - 2021,6 episodes,"Will Astro survive the Korean fashion Dark Ages and manage to pull off the concepts?!

(Source: Universe Twitter)",8.6
Star Road: Kang Daniel,Korean TV Show - 2019,8 episodes,Series of videos to learn more about the Korean singer Kang Daniel.,8.4
The First Date Season 2,Korean TV Show - 2020,2 episodes,"A friendship project for female idol singers, The First Date! This time, a real successful fan made her dream come true! A true Orbit, Jihan from Weeekly cried again after meeting Olivia Hye from LOONA?! Aww - is she…",8.6
GameCenter CX: Season 9,Japanese TV Show - 2008,6 episodes,"Videogame variety show in which the host, Shinya Arino, is challenged with playing several games from previous eras.",8.6
Monsta X Speak Out,Korean TV Show - 2021,9 episodes,"Monsta X's personal explanations of various social issues and controversies!!!
(Source: @into__universe on Twitter)",8.5
Q&A With E.L.F.,Korean TV Show - 2021,7 episodes,"Super Junior's D&E receive and answer fan questions.

(Source: XingBack at MyDramaList)",8.6
Wonderland Junior Season 2,Chinese TV Show - 2023,20 episodes,"15 young artists lived in Taohuawu together. This time, the residents of Wushu went to the mountains, embraced the mountains, talked with their hearts, found the strength of their original intentions, met unknown challenges,…",8.4
Space Force A: Secret Golden Bowl,Korean TV Show - 2021,10 episodes,Overview not available,8.6
L.O.V.E STORY: NU'EST LAB,Korean TV Show - 2020,16 episodes,Overview not available,8.6
TW-Log with Secret Friend,Korean TV Show - 2021,10 episodes,"A vlog series where each girl from TWICE prepare secret santa gifts for their giftee while they find out who will gift them.

(Source: MyDramaList)",8.6
THE BOYZ Chemi-Mate ZZG,Korean TV Show - 2021,8 episodes,Overview not available,8.6
Over 2PM: GRHC,Korean TV Show - 2018,3 episodes,Overview not available,8.6
Star Road: Seventeen,Korean TV Show - 2018,24 episodes,"Star Road returns with an in-depth look into the K-Pop boy group Seventeen.

(Source: elfie at MyDramaList)",8.5
GFRIEND's MEMORIA in Gapyeong,Korean TV Show - 2020,7 episodes,GFRIEND goes to Gapyeong to play mini games.,8.6
Best Choice,Korean TV Show - 2021,27 episodes,"A broadcast that collects everything Min Ho likes, his best choice.

(Source: Namu.wiki)",8.5
No Laughing Enthusiastic Teachers,Japanese TV Show - 2012,1 episodes,Overview not available,8.6
DMD Reality,Thai TV Show - 2021,4 episodes,The 6 new kids will try live and do activities together for 2 days and 1 night,8.4
GFRIEND's MEMORIA - Cooking Show,Korean TV Show - 2021,2 episodes,"GFriend will be hosting a high-quality cooking show for fan club Buddy to mark her sixth anniversary of their debut. In this episode, GFriend challenges themselves to make dishes they want to eat with Buddy on a luxury…",8.6
2022 Dream Week,Korean TV Show - 2022,1 episodes,Overview not available,8.6
The Play: THE BOYZ League,Korean TV Show - 2020,2 episodes,Overview not available,8.5
Secret Code 9,Korean TV Show - 2018,4 episodes,"Find the title of the new comeback song in SF9 challenging the mission!

(Source: YouTube)",8.6
A Clean Sweep Season 2,Korean TV Show - 2023,41 episodes,Season 2 of the baseball variety show where amateur baseball players go up against legendary pros who retired less than 5 years ago in several games to determine the ultimate winning team. The goal? The pros need to…,8.5
Harmony Forest Season 2,Korean TV Show - 2022,8 episodes,"From starting as entertainment sprouts to becoming trees, P1Harmony now came for the second season of HARMONY FOREST in which they will compete in several challenges and games to find out who's the best variety star!…",8.6
Mr. Trot Season 1,Korean TV Show - 2020,12 episodes,"Mr Trot became one of the most popular shows on Korean television. Currently, it is the highest-rated broadcast in cable television history in the country.

(Source: Wikipedia)",8.6
Time To Twice: Twice New Year 2022,Korean TV Show - 2022,5 episodes,"New season of  Twice's reality ""Time To Twice""",8.5
iKON Amigo TV Season 4,Korean TV Show - 2018,3 episodes,Overview not available,8.6
Halo! Sekolah Bahasa Indonesia,Korean TV Show - 2020,6 episodes,"A school based web show where NCT members Taeil, Yuta, Doyoung, and Haechan learn more about Indonesian terms and culture.",8.5
Idol Tour: Apink,Korean TV Show - 2020,4 episodes,"“Idol Tour” is a reality series produced by 1theK. Apink was the second group to be feature in the series.

(Source: Kpop Fandom)",8.6
Circle House,Korean TV Show - 2022,10 episodes,"""Circle House"" is a healing talk show that candidly shares realistic concerns experienced by the MZ generation in Korea and seeks solutions with applicants.

(Source: kbizoom.com)",8.5
Dreamcatcher's VLOG,Korean TV Show - 2019,149 episodes,A vlog series following the daily activities of the k-pop girl group Dreamcatcher.,8.4
Monsta X’s Newtro Land,Korean TV Show - 2020,7 episodes,"Monsta X’s Newtroland will present the story of the group’s members who will be reinterpreting retro-concept items with the sentiment of “Newtro”, a combination of the words “new” and “retro”. (Source:…",8.5
A Clean Sweep Season 1,Korean TV Show - 2022,35 episodes,"Amateur baseball players go up against legendary pros in a championship to determine to determine the ultimate winning team.

(Source: Netflix)",8.5
No Laughing Hotel Employee,Japanese TV Show - 2009,1 episodes,Overview not available,8.5
SNUPER Player,Korean TV Show - 2018,19 episodes,Overview not available,8.6
AKB Kosagi Dojo,Japanese TV Show - 2012,66 episodes,Overview not available,8.4
I'M FACT Season 1,Korean TV Show - 2016,11 episodes,Overview not available,8.8
"Summer Is Here, the Ally Is Not at Home",Chinese TV Show - 2021,5 episodes,"This summer the bands (Air league band, Nap phonograph band, Fruit planet band, Galaxy band) will travel to Xi'an, Hohhot, Shanghai, and Changsha to represent the big four southeast, northwest and northwest Cities, partners,…",8.6
Landing in Pairs,Chinese TV Show - 2020,6 episodes,16 players compete in a game of Game for Peace to find the best CP.,8.1
HIT Village: TO1,Korean TV Show - 2021,1 episodes,Overview not available,8.2
Weki Meki Mohae?,Korean TV Show - 2018,60 episodes,Web variety show about idol group Weki Meki.,8.5
GoToon by GOT7 Summer Store,Korean TV Show - 2020,3 episodes,Overview not available,8.5
KAT-TUN no Sekaiichi Tame ni Naru Tabi! SP 2,Japanese TV Show - 2014,1 episodes,"KAT-TUN are taken to Okinawa in Japan where they are given 3 rules within the trip:
1. Orders are absolute
2. They can't use money
3. They have to negotiate and do everything with their own power",8.4
My Little Kitchen Season 1,Korean TV Show - 2015,9 episodes,"Has your Hallyu craze piqued your interest in learning how to cook Korean food? You’re not alone! Known as “hansik,” Korean food can seem a little daunting to cook to foreign fans. The two hosts of the show, Chef…",8.6
Military Idol Camp,Korean TV Show - 2021,12 episodes,Overview not available,8.6
Work Hard Play Hard,Korean TV Show - 2021,6 episodes,"The members of Astro work at a company named ""Destruction lab"" and are assigned to a very important mission: the members have to try out different sports like tabletennis, bodyboarding and ice skating so that they can…",8.6
HI-YENA,Korean TV Show - 2022,10 episodes,Overview not available,8.6
UNDERTONES feat.DAY6,Korean TV Show - 2021,2 episodes,DAY6’s hilarious fashion variety show! Sweeter than a song collection! Come watch the Q&A!,8.5
Nogizaka Under Construction,Japanese TV Show - 2015,500 episodes,"Nogizaka Under Construction is Nogizaka46's current weekly variety show. It is hosted by the comedy duo, ""Bananaman,"" and airs every Sunday night. It was the immediate successor to their previous variety show, Nogizakatte,…",8.6
Sekai no Hate Made ItteQ!,Japanese TV Show - 2007,300 episodes,"The show features several regular host members going around the world looking at and doing humorous and amazing things, each host having their own little twist and style.",8.6
NIERL-ry Christmas,Korean TV Show - 2019,2 episodes,Christmas Special video with South Korean singer Kang Daniel.,8.6
Mulberry School Season 1,Korean TV Show - 2020,39 episodes,"Top singers from ""Mr. Trot"" enter Mulberry School to train and become trot superstars. Guests who visit the school share their know-how and offer friendly competition. Under the teacher's guidance, the students strive…",8.6
Real World,Korean TV Show - 2020,8 episodes,"“Real World” is a web variety show where Sunmi will personally experience what it’s like to be a fan. On May 29, mu:fully shared, “By meeting real-life fans, Sunmi will dig into the world of a fan, which is an…",8.6
Loukgolf’s English Room,Thai TV Show - 2015,238 episodes,"Kanatip Soonthornrak English Room talking to celebrities and actors, playing fun games together.",8.5
Drink with God Season 1,Korean TV Show - 2021,10 episodes,"A TV program that recommends drinks and recipes to accompany drinks while listening to stories and concerns sent in by viewers.

(Source: Soompi)",8.5
Finding Nemo,Korean TV Show - 2021,2 episodes,"LIGHTSUM who is excited to shoot their first show had a sudden treasure hunt! Let's see how would they do without even knowing the treasure is.

(Source: milcah at MyDramaList)",8.6
DKB Art School,Korean TV Show - 2021,7 episodes,"This show, provided by the entertainment YouTube channel 스타플러스 STARPLUS, is DKB's idol debut survival.

On this show DKB's members are back as Art School students. 

(Source: STARPLUS)",8.4
WORLD-CLASS K-DOL,Korean TV Show - 2022,5 episodes,Overview not available,8.6
Birdie Boys,Korean TV Show - 2022,10 episodes,"'Birdie Boys' follows these five K-Pop stars as they take off on vacations all over the world with the aim of conquering the most beloved golfing spots of all time. The program will feature golfing, travel, as well as…",8.6
The Epex Season 2,Korean TV Show - 2022,10 episodes,Overview not available,8.5
The Latest Beauty Trends,Korean TV Show - 2022,3 episodes,Overview not available,8.6
Family Feud Season 3,Hong Kong TV Show - 2023,28 episodes,"~~ Remake of the American TV game show ""Family Feud"" [1976].",8.6
School Rangers Extra Chapter: Once Upon a Ranger,Thai TV Show - 2024,1 episodes,"As the original cast of School Rangers moves on, they reminisce about their experiences over the previous six years. 

(Source: MyDramaList)",8.0
Game of Princes: Will I Be the King?,Korean TV Show - 2021,3 episodes,"The members of THEBOYZ gather as princes to vie for the throne of THE B empire. For three episodes, they will compete in a series of games testing their wisdom, virtue, and stamina; key characteristics befitting a king.…",8.5
Apink News: Season 3,Korean TV Show - 2012,13 episodes,"Prior to the group's debut, the documentary A Pink News aired on the Korean cable channel TrendE. The show chronicled the debut process of the members of A Pink.",8.5
The CIX Million Dollar Kids,Korean TV Show - 2021,6 episodes,Overview not available,8.6
Show Me the MWM Season 2,Korean TV Show - 2021,4 episodes,"The shocking image of ONEUS have been released, who came back with ""No diggidy""??! The spiciest and strongest member of ONEUS chosen by the comments made in the studio of Show Me the MWM 2! It's so strong! Who's the…",8.5
The Play: Vietnam,Korean TV Show - 2018,6 episodes,The Boyz Variety Show,8.6
Human Table,Korean TV Show - 2022,10 episodes,"""Human Table"" is a food documentary with two men who are passionate about barbecue. ""Documentaries look at things slowly, and seriously, and reveal the long-term. It's that kind of genre. Through 'Human Table', I capture…",8.5
"Sechskies, What Happened In Bali",Korean TV Show - 2019,10 episodes,A Korean reality show for Sechskies' 22nd Debut Anniversary.,8.6
Let's Victon Season 1,Korean TV Show - 2021,4 episodes,Overview not available,8.5
Level Up! Project Season 5,Korean TV Show - 2022,12 episodes,"In the fifth season of Level Up! Project, Red Velvet travel to Jeju Island for the ""Friendship UP Project"" as they strengthen their friendships with each other.

(Source: korea.postsen.com)",8.5
Monsta X's Glamping With TWOTUCKGOM,Korean TV Show - 2020,5 episodes,"Monsta X goes glamping! The members enjoy relaxing, playing games, and making food.",8.5
No Foundation Youth Trip: Season 1,Korean TV Show - 2017,7 episodes,Overview not available,8.6
Bling Bling De Time Season 1,Chinese TV Show - 2022,67 episodes,"""Bling Bling de Time"" is a long-running daily reality show that records and observes the life and growth of artists. The show records the living conditions of young artists living alone in parallel, and invites artists…",8.6
BbamBbam Social Club,Korean TV Show - 2023,8 episodes,"It’s a new show with social concept where each person chooses and drinks the liquor they want, talks and interacts with each other.

(Source: Korean = DAUM || Translation = eternallyksw on Twitter)",8.6
GOT7: On the Scene,Korean TV Show - 2018,16 episodes,"""GOT7:On the Scene"" is a making series of GOT7.",8.6
NU'EST Road,Korean TV Show - 2019,4 episodes,"'NU'EST Road' is a reality show that features all five members go on a friendship journey to discover unknown travel destinations and create precious memories together. 

(Source: allkpop)",8.5
TMT Monsta X,Korean TV Show - 2022,3 episodes,"Chaotic & Crazy Talk Show (Too Much Talk), a time to find out the A to Z of your artist that you have never seen before. The second star of the show!

(Source: Universe App)",8.7
Watching it in Japan,Thai TV Show - 2017,5 episodes,Overview not available,8.6
Wooseok's Unboxing,Korean TV Show - 2020,8 episodes,"Kim Woo Seok’s first solo variety program will showcase moments from his ordinary everyday life as well as the preparation process for his first solo album. In the newly released teaser, Kim Woo Seok holds up a large,…",8.5
E.M.S Earth - Mix Space Special,Thai TV Show - 2023,3 episodes,"All right, all right, Earth - Mix is here!! This event came in a thrilling way. With games that made Earth Mix scream loudly! Along with answering Q&A questions from fans, let's see what this event will be like!!! (Source:…",8.6
DKB United,Korean TV Show - 2022,4 episodes,"In ""DKB United"", DKB's first ever solo reality show, the members are faced with various challenges and have to carry out entertaining missions. They also collaborate with MNET's street dance girls fighter team 'Amazon'…",8.6
The Boyz Parenting Diary,Korean TV Show - 2022,2 episodes,"In this show, The Boyz met two adorable babies and did a babysitting mission for one day.",8.5
Kun's Cloud,Chinese TV Show - 2019,16 episodes,"""Kun's Cloud"" is a vlog formatted series uploaded on Instagram following Kun and his fellow members of WayV. The series is filmed and edited by Kun himself. The series was uploaded on IGTV and Weibo beginning on WayV's…",8.4
Amazing Mokpo,Korean TV Show - 2022,3 episodes,"The Boyz member will show us beautiful places to go to around Mokpo.

(Source: Mia at MyDramaList)",8.4
Pentahouse,Korean TV Show - 2021,8 episodes,"Pentagon's reality show to celebrate their 5th anniversary since debuting.

(Source: MyDramaList)",8.6
XJR Sports Carnival,Chinese TV Show - 2020,13 episodes,"6 celebrities, as the leaders, and 24 adorable preschoolers are separated into 3 teams to compete in sports games. This event is also formed by Olympic champions, parenting experts, child psychologists, and nutritionists.…",8.5
Aratsubo,Japanese TV Show - 2019,1 episodes,An annual New Years Special. A talk based on rankings that have not yet been decided in the world.,8.5
iKON's Heart Racing Youth Trip,Korean TV Show - 2018,10 episodes,iKON goes to Hawaii for some healing time! Members choose from OX cards to determine their activities during the trip.,8.6
Vocal Play Season 1,Korean TV Show - 2018,12 episodes,"Vocal Play is the first Korean Acappella music show where singers have to sing without the backing of musical accompaniment. The best singers start their journeys: acappella performers, K-pop idols, rappers, and beatboxers.…",8.5
No Plan Calendar Project,Japanese TV Show - 2020,3 episodes,"A documentary documenting the shooting of Satoh Takeru's 2021 Calendar. Kamiki Ryunosuke is the photographer for Takeru 2021 Calendar, meanwhile Sakurada Dori is in charge of filming its behind the scene video.",8.5
QT Show,Korean TV Show - 2018,2 episodes,Overview not available,8.5
GFRIEND's MEMORIA - Game Friend,Korean TV Show - 2021,2 episodes,"After the series GFRIEND's MEMORIA - Home Together,  next they playing game together. They seperate in to 2 teams  call ""Paper"" (Eunha, Sowon, Umji) and ""Rock"" (Sinb, Yuju, Yerin)",8.4
Bu:QUEST of RED VELVET,Korean TV Show - 2020,8 episodes,Overview not available,8.5
N.Flying Seunghyub's Summer Camp Season 3,Korean TV Show - 2020,3 episodes,"For the third year in a row, the members of N.Flying are going on a self planned summer trip.",8.5
VsArashi Saikyou Ouja Kettisen Special #2,Japanese TV Show - 2009,1 episodes,"This is the second special for the show ☆ Guest team: Athletes team and Celebrity Team ☆ Special Appearance: Code Blue Cast Games include Falling Pipe, Pinball Runner, Jumping Shooter, Cliff climb, Rolling Coin Tower",8.5
YG TV: iKON's Oogiri Battle,Japanese TV Show - 2018,4 episodes,Overview not available,8.6
Summer Night’s fromis_9,Korean TV Show - 2022,9 episodes,A live show that records the story of summer nights with fromis_9.,8.1
Salon Drip Season 2,Korean TV Show - 2023,70 episodes,"Culture, art, philosophy, and even rumors floating between conversations. Anyone who wants to speak up, gather around! This is Salon Drip!

(Source: Korean = Namu-Wiki || Translation = aciegna at MyDramaList)",8.3
2PM Oven Radio,Korean TV Show - 2015,5 episodes,"5 Minutes, no more no less, of super fun jammed 'Oven Radio' with 2PM!  

 (Source: 1theK Youtube)",8.5
IU's Homebody Signal,Korean TV Show - 2020,11 episodes,Overview not available,8.5
GFriend's Memoria in Yangyang,Korean TV Show - 2020,6 episodes,"The girls dropped their poster featuring the new name 'GFriend's Memoria'. The show had originally been named 'GFriend's Memorial', but fans protested for obvious reasons. The name has now been changed to 'GFriend's…",8.5
Show Me the MWM Season 1,Korean TV Show - 2020,4 episodes,"The series will follow the boy group as they transform themselves from mild to spicy.

(Source: Allkpop)",8.5
The Play: THE BOYZ Gathering of Kings,Korean TV Show - 2020,2 episodes,Overview not available,8.5
Pretty Boys for T-ara,Korean TV Show - 2011,11 episodes,The show is about T-ara selecting a group of good-looking guys with talents like dancing (from the first episode) and their subsequent group date with them.,8.4
No Laughing Airport,Japanese TV Show - 2011,1 episodes,Overview not available,8.5
Let's Go Hunter Season 2,Thai TV Show - 2020,10 episodes,Thai band SBFIVE members compete for treasure.,8.5
Daily Us Season 2,Korean TV Show - 2021,4 episodes,"Daily Us Season 2 will depict the fierce survival journey of T1419, as the group does everything on their own, from grocery shopping to cooking.",8.5
Otoseyo?,Japanese TV Show - 2018,73 episodes,Overview not available,8.3
Music Blood,Japanese TV Show - 2021,78 episodes,Overview not available,8.6
MMM_Where Are We Now,Korean TV Show - 2022,4 episodes,"The 4-part documentary covers the story of MAMAMOO, a representative group in the world of K-Pop, and their 7-years together from debut until now. The members will be opening up about the famed ""7-year curse"", and how…",8.5
VS Arashi ~Golden Time! Extravagant Three-Way 2 Hours SP~,Japanese TV Show - 2009,1 episodes,"Guests : Tokyo Dogs and Red Theatre (aka Tokyo Theater)

Games: Falling Pipe, Pinball Runner, Giant Crusher, Cliff Climb, Bank Bowling, Rolling Coin Tower",8.5
RARE-TAEM,Korean TV Show - 2020,5 episodes,"Taemin's solo reality show where you will experience gaming, healing, cooking and mukbang with Taemin! The broadcast ended with 5 episodes on October 1st. Bonus episodes ""Behind The Scenes"" and ""Epilogue"" will air on…",8.5
SJ NEWS,Korean TV Show - 2020,3 episodes,Overview not available,8.5
ASTRO Project,Korean TV Show - 2016,5 episodes,"ASTRO will be greeting fans through their first reality show since debut, on MBC every1 and MBC Music's 'ASTRO Project'! The upcoming 'ASTRO Project' will take on the theme, 'The beginning of ASTRO's Asia tour', during…",8.5
