Web Series Name,Original Language - Year of Release,Episodes,Overview,MDL Rating
Single’s Inferno Season 1,Korean TV Show - 2021,8 episodes,"Stranded and ready to mingle, flirty singles search for love on a deserted island, they can only escape as couples for romantic date nights in paradise. 

(Source: Netflix)",7.9
Running Man,Korean TV Show - 2010,740 episodes,"In each episode, the members must compete in a series of games and missions to win the race. As they fight to win prizes and avoid penalties, the members show their chemistry with each other and the celebrity guests…",9.2
Busted Season 1,Korean TV Show - 2018,10 episodes,"Tackling different mysteries in each episode of this game show, seven sleuths get closer to solving the biggest one of all: What happened to Project D? Seven celebrity sleuths discover that they are a part of an operation…",8.6
Single’s Inferno Season 2,Korean TV Show - 2022,10 episodes,"A new cast of singles comes together on a remote island seeking love. Who will find that special someone and make their escape to a luxurious getaway?

(Source: Netflix)",8.1
Young Actors' Retreat,Korean TV Show - 2022,8 episodes,"“Youth MT” is a new TVING variety show featuring the reunion of actors from “Love in the Moonlight,” “Itaewon Class,” and “The Sound of Magic.” The casts of producing director (PD) Kim Sung Yoon’s three…",9.0
I-LAND,Korean TV Show - 2020,12 episodes,"23 young male K-pop trainees, born between 1997 and 2006, attempt to become the hottest new thing in global pop music. The trainee group has been working toward its big moment for some 12 months, with contestants selected…",8.5
Busted Season 2,Korean TV Show - 2019,10 episodes,"Amateur detectives attempt to untangle a string of mystifying cases, which may be connected to an enigmatic figure known as the Flower Killer. 

(Source: Netflix)",8.8
Physical: 100,Korean TV Show - 2023,9 episodes,"In this fierce fitness competition, one hundred contestants in top physical shape compete to claim the honor of best body.

(Source: Netflix)",8.3
Kingdom: Legendary War,Korean TV Show - 2021,10 episodes,"The sequel to Mnet's ""Road to Kingdom"". A survival competition show featuring K-pop boy groups and their performing potential. Final line up for Kingdom: The Boyz, Stray Kids, Ateez, BTOB, iKON & SF9. (Source: OneTouchTV.me)",8.4
Run BTS! Season 1,Korean TV Show - 2015,10 episodes,"A variety show by the South Korean boy band BTS. In each episode, all 7 members play games and/or participate in various activities set up by their staff in order to complete challenges and even carry out secret missions,…",8.6
Run BTS! Season 2,Korean TV Show - 2017,46 episodes,"Run BTS! is a reality show starring BTS, where they play various games and compete in various competitions individually or in groups. Season 2 ran from episodes 11-56.",8.7
Boys Planet,Korean TV Show - 2023,12 episodes,A group of male K-pop wannabes – including a few established stars – vie for the right to join a brand-new group and compete for chart glory. Trainees are divided into two groups. There will be a K-group for South…,8.2
BTS in the Soop Season 1,Korean TV Show - 2020,8 episodes,"“In the SOOP BTS Ver.” (“soop” means “forest” in Korean) So the show takes place in the forest. The concept is to spend time doing activities that are ""somewhere between everyday life and relaxation."" Participants…",8.8
Busted Season 3,Korean TV Show - 2021,8 episodes,"With old faces back on the team, the detectives investigate a series of bewildering cases that seem to be linked to a shady organization.

(Source: Netflix)",8.7
Knowing Bros,Korean TV Show - 2015,460 episodes,"It is a sitcom talk show program set in a school. In each episode, new celebrity guests appear as transfer students at the 'Brother School' where seven mischievous brother students wait for them. The show consists of…",8.7
His Man Season 1,Korean TV Show - 2022,11 episodes,"As South Korea's very first gay dating reality series, ""His Man"" brings together a group of eight hot, sexy, free and single gay men to a shared house where they are to live, interact and open up to each other in their…",8.3
Run BTS! Season 3,Korean TV Show - 2019,99 episodes,"Run BTS! is a reality show starring BTS, where they play various and often unique games, competing individually or in groups. Season 3 starts from episode 57.

(Source: MyDramaList)",8.8
Single’s Inferno Season 3,Korean TV Show - 2023,11 episodes,"Stranded and ready to mingle, flirty singles search for love on a deserted island they can only escape as couples for romantic date nights in paradise.

(Source: Netflix)",7.9
BTS in the Soop Season 2,Korean TV Show - 2021,5 episodes,"""BTS in the Soop Season 2"" is HYBE's entertainment reality program, which contains a healing story in the forest, this time in Pyeongchang-gun, Gangwon-do, South Korea. Here all seven BTS members enjoy their time separately…",9.3
In The Soop: Friendcation,Korean TV Show - 2022,4 episodes,"'In the Soop: Friendcation', which will be aired in July, is a spin-off of 'In the Soop' and depicts a travel story of Park Seo-joon, Peakboy, Choi Woo-shik, Park Hyung-sik, and BTS V, best friends of the entertainment…",8.8
Twogether,Korean TV Show - 2020,8 episodes,"Paired together for an unforgettable trip across Asia, stars Lee Seung Gi and Jasper Liu become buddies as they connect with fans and local cultures.

(Source: Netflix)",8.8
Produce 101 Season 2,Korean TV Show - 2017,11 episodes,"Produce 101 Season 2 brings together 101 trainees from different entertainment companies in South Korea, and 11 trainees are selected through audience voting to form a boy band. The group will perform for 2 years together…",8.3
BTS: Bon Voyage,Korean TV Show - 2016,8 episodes,"In season one, let's see stories of BTS travelling around North Europe during 10 days, celebrating their 3rd year!",8.6
Nineteen to Twenty,Korean TV Show - 2023,13 episodes,“19/20” captures the growth and freedom of young 19-year-olds as they turn 20. The show will follow various Gen Z’s as they enjoy their final week being 19 and their first week being 20 after ringing in 2023. The…,8.7
His Man Season 2,Korean TV Show - 2023,14 episodes,"Eight attractive guys cohabitate for eight days, leading to exciting chemistry and unexpected connections. 

(Source: Gagaoolala)",8.5
BTS: Bon Voyage 2,Korean TV Show - 2017,8 episodes,"Season two, we follow BTS as they have a memorable 9 day travel in Hawaii!",8.6
The Devil's Plan,Korean TV Show - 2023,12 episodes,A mind game survival entertainment show that awards up to 500 million Korean won to the winner. Participants including celebrities and influencers and recruits of this game begin with the devil’s suggestion to take…,8.6
Jinny's Kitchen,Korean TV Show - 2023,11 episodes,"In a small beautiful town in Mexico, Bacalar, Jinny’s Kitchen opens, introducing Korean street food to their passionate customers! Meet Seo Jin, the boss who is serious about the business, Yu Mi, the new executive,…",8.9
Produce 101,Korean TV Show - 2016,11 episodes,"Produce 101 is the nation's first agency-collaboration unit girl group project, which brings together 101 trainees from different entertainment companies both inside and outside of South Korea. From the 101 trainees,…",8.1
Produce X 101,Korean TV Show - 2019,12 episodes,"Produce X 101 was the fourth season of Mnet’s reality television talent competition franchise Produce 101. The public (called 'national producers') ""produces"" a boy band by choosing 11 members among the 101 trainees…",8.2
EXO's Showtime,Korean TV Show - 2013,12 episodes,"EXO's Showtime is a South Korean documentary starring the boy group EXO. It is the first season of the South Korean reality show series, Showtime.",8.9
BTS: Burn The Stage,Korean TV Show - 2018,8 episodes,"Burn the Stage follows the 300-day journey of the K-Pop group, BTS' world tour, 2017 BTS LIVE TRILOGY EPISODE : THE WINGS TOUR. This show is an intimate, personal portrayal dedicated to each other and to their fans across…",8.7
Stray Kids,Korean TV Show - 2017,10 episodes,"JYP Entertainment and Mnet’s new boy group survival program is titled “Stray Kids,” which refers to idols who have left home and also captures the mindset of being free from standardization and stereotypes. Rather…",8.6
BTS: Bon Voyage 3,Korean TV Show - 2018,8 episodes,"BTS Bon Voyage is back as usual with it's third story. The seven members are making happy memories in Malta! This year, it is spectacular beyond your expectation as always! Are you ready to fly away with BTS to a beautiful…",8.7
Going Seventeen 2020,Korean TV Show - 2020,47 episodes,"A show which takes us through fun and games with each SEVENTEEN member. This year the format will also include ""Monthly Seventeen"" in which a designated member will be in charge of providing ideas for the month's video…",9.4
BTS: Bon Voyage 4,Korean TV Show - 2019,8 episodes,"BTS sets out on another adventure on BTS Bon Voyage Season 4! Following their adventures in Scandinavia, Hawaii, and Malta, the members head to New Zealand for a trip of their own, as would any other young people in…",8.7
Idol Producer,Chinese TV Show - 2018,12 episodes,"Chinese reality boy group survival show. Brings together 100 different trainees, and only nine will be chosen. The final nine contestants debuted in the group, Nine Percent, also known as 9%.",8.6
Sixth Sense,Korean TV Show - 2020,8 episodes,Korea’s top stars have gathered to really use their sixth sense. Each week they will encounter the hottest places or people and have to distinguish one fake set-up. The production crew uses all of their resources and…,8.8
EXO Arcade Season 1,Korean TV Show - 2018,5 episodes,"EXO's New Variety Show is coming with Lee Soo Geun as MC. On this show we'll see Exo's members playing games, dancing, answers questions and have fun!",9.1
Produce 48,Korean TV Show - 2018,12 episodes,"Being a collaboration between Korea’s “Produce 101” series and Japan’s AKB48 system, ‘Produce 48’ will feature competitions among 96 trainees from both South Korea and Japan, contesting for four months to…",7.8
Road to Kingdom,Korean TV Show - 2020,8 episodes,"Male artists will release songs on the same day at the same time to compete on music charts. 

Participating groups are: PENTAGON, ONF, GOLDEN CHILD, THE BOYZ, VERIVERY, ONEUS, TO1.",8.5
Girls Planet 999,Korean TV Show - 2021,12 episodes,"A program surrounding female Korean, Chinese, and Japanese contestants who have the same dream of debuting in an idol group despite having different languages and cultures. Their growth as they head towards their goal…",7.3
SKZ CODE,Korean TV Show - 2021,58 episodes,"SKZ CODE is a variety web show by Stray Kids. As a sequel to “The 9th,” the members try various activities, games and missions in a reality show format.

(Source: MyDramaList)",9.2
The Boyfriend,Japanese TV Show - 2024,10 episodes,"Over the course of a month, a group of men live under one roof and run a coffee truck together to connect and hopefully meet their one true boyfriend.

(Source: Netflix)",8.9
Hana yori Dango 2 (Returns) Bangai hen: Makinoke Hajimete no Kazoku Ryoko in N.Y.,Japanese TV Show - 2007,1 episodes,"The Makinos take New York in this special Hana Yori Dango spin-off. Worried about Tsukushi going to New York by herself to look for Tsukasa, the Makino parents also head to the Big Apple for their first family vacation.…",7.8
EXO's Ladder Season 2,Korean TV Show - 2019,50 episodes,"Exo's newest Reality show, where they travel to different countries. Using a 'ladder' to help decide their situations. 

This season will consist of all of the members in Taiwan.",9.1
Going Seventeen 2019,Korean TV Show - 2019,28 episodes,The show on official  SEVENTEEN YT channel which takes us behind the scene of  SEVENTEEN's member.,9.2
Seventeen in the Soop,Korean TV Show - 2021,8 episodes,"“In the SOOP” (“soop” means “forest” in Korean) takes place in a house in the woods, and the concept is to spend time “somewhere between everyday life and leisure"". Participants will create their own schedules…",9.2
Going Seventeen 2021,Korean TV Show - 2021,35 episodes,"The third season of Going Seventeen. This season's keyword is ""watch what you say"" where anything the members say can and will be turned into content.",9.4
Break the Silence: Docu-Series,Korean TV Show - 2020,7 episodes,"Follow the 351-day journey of BTS from 'LOVE YOURSELF TOUR' to 'SPEAK YOURSELF TOUR' in the all-new docu-series. 

(Source: Weverse Official Twitter)",9.2
Sixth Sense 2,Korean TV Show - 2021,14 episodes,"A mystery-solving game variety series where the cast members must divide up into teams and figure out what's ""real"" and what's ""made up"".

(Source: Naver)",8.8
The Return of Superman,Korean TV Show - 2013,560 episodes,"Celebrity dads are left to care for their kids alone for 48 hours without the help of anyone, while their wives leave the home to enjoy some relaxing time off. The wives are shown leaving the home before the 48 hours…",8.7
Roommate Season 1,Korean TV Show - 2014,20 episodes,"Eleven celebrities live together in close quarters as they share the cooking, cleaning and everyday chores around the house. Will they become close friends? Develop deeper relationships? Or find themselves fighting each…",8.2
Going Seventeen 2022,Korean TV Show - 2022,29 episodes,The fourth season of Going Seventeen. This Going Seventeen season starts in the year 2022 with episode 36.,9.3
New World,Korean TV Show - 2021,8 episodes,"In this reality show, six celebs arrive at a magical island called The New World. For 6 days they work through challenges to gain a virtual currency, which places them on a leaderboard, on the last day of their stay…",8.5
Little Forest,Korean TV Show - 2019,16 episodes,"From fine dust in the playgrounds to noise complaint issues in the apartments, children these days have fewer and fewer reasons to spend time running and playing outdoors. An eco-friendly childcare center in the woods…",8.9
Master in the House,Korean TV Show - 2017,238 episodes,Almost everyone questions the purpose and goal of life. And most successful people have unique perspectives and lifestyles that have made them stand out from the norm. This reality show stars five young men; Lee Seung…,8.6
EXchange Season 1,Korean TV Show - 2021,15 episodes,"A dating reality program that will form a consensus about the breakup that everyone experiences at least once, such as reuniting with an ex-lover or meeting new people. (Source: Korean = Naver || Translation = MyDramaList)",8.1
Hyori's Bed And Breakfast,Korean TV Show - 2017,14 episodes,"The famous diva, Lee Hyo Ri, has been taking a long hiatus from the spotlight and enjoying her life in the suburbs of Jeju Island with her husband. The couple has decided to open up their home as a Bed and Breakfast…",8.9
Bring The Soul: Docu-Series,Korean TV Show - 2019,6 episodes,"‘LOVE YOURSELF.’ One message that touched the hearts of ‘ARMY’ across the world. Behind the free and spirited presence on the stage, are the members doing their best to love themselves, personifying the message…",9.2
EXchange Season 2,Korean TV Show - 2022,20 episodes,"EXchange is back with its second season, and the participants’ stories are more intriguing than ever. Four pairs of ex-couples must live under one roof and decide whether to reunite with their ex or find new love.…",8.5
The Unit,Korean TV Show - 2017,28 episodes,“The Unit” aims to create the best idol unit by uncovering already debuted singers’ talent and potential in a program where viewers get to pick the unit members. Viewers who get to participate in the first recording…,8.0
Off Gun Fun Night Season 1,Thai TV Show - 2017,9 episodes,"On the 12th of every month we are delivered with a talk show filled with games, laughs, stories and celebrity guests hosted by Off and Gun.",8.8
Street Woman Fighter,Korean TV Show - 2021,9 episodes,"“Street Woman Fighter” is Mnet’s first-ever female dance crew survival program, where eight female dance crews that represent South Korea will compete to be the No. 1 team. The dancers will showcase various genres…",8.4
NCT WORLD 2.0,Korean TV Show - 2020,8 episodes,"Mnet’s “NCT WORLD 2.0” is the first reality show starring all 23 members, including new additions Shotaro and Sungchan. The show will be based on the concept of a multiverse, featuring multiple dimensions. (Source:…",9.0
Weekly Idol,Korean TV Show - 2011,700 episodes,"The main segment of the show, called ""Idol of the Week"", features idol groups as the invited guests, and usually consists of several featured corners.",8.2
New Journey to the West Season 4,Korean TV Show - 2017,11 episodes,"After taking trips to China in the first three seasons, Korean celebrities venture into Vietnam in “New Journey to The West: Season 4”! The fourth season features cast members Kang Ho Dong, Eun Ji Won, Lee Soo Geun,…",9.0
2 Days & 1 Night Season 4,Korean TV Show - 2019,260 episodes,"The cast members take various trips throughout South Korea, including many offshore islands, recommending various places that viewers can visit. While doing so, members also perform missions at a certain mealtime or…",8.8
Queendom Season 1,Korean TV Show - 2019,10 episodes,"The concept of “Queendom” revolves around six artists; Park Bom, AOA, Mamamoo, Lovelyz, Oh My Girl, and (G)I-DLE, releasing singles on the same day at the same time to compete it out on the music charts. (Source:…",8.3
Physical: 100 Season 2 - Underground,Korean TV Show - 2024,9 episodes,"In Season 2, a new batch of 100 contestants at their physical peak will enter the arena and compete to be the last one standing after an elimination-style fight to the finish. And just like last season, anyone, regardless…",8.3
New Journey to the West Season 3,Korean TV Show - 2017,10 episodes,"Each member takes one of the characters from the classic Chinese novel “Journey to the West” as they go to different destination every season. In Season 3, Kang Ho-dong, Eun Ji-won, Lee Soo-Geun, Ahn Jae-Hyun, Mino…",8.9
Zombieverse,Korean TV Show - 2023,8 episodes,"'Zombie-verse' invites viewers to experience an alternate reality immediately after the end of the COVID-19 pandemic, right around the time when outdoor filming was being permitted. Each episode, the cast members must…",7.4
Terrace House: Boys & Girls in the City,Japanese TV Show - 2015,46 episodes,"Six real-life strangers start their lives together under one roof.  All they get is a fabulous home in Tokyo, Japan and a car. As always, there is no script. Friendships, fights, intrigue, and even love follow.",8.0
Run BTS! 2022 Special Episode: Fly BTS Fly,Korean TV Show - 2022,2 episodes,The aim of this episode is to make BTS take social media worthy photos. And the trick is that they need to learn how to do flying yoga poses. A special trainer is called in for the members as they stretch their muscles…,9.2
Nana Tour with Seventeen,Korean TV Show - 2024,6 episodes,"Here comes the 7-day vacation full of laughter! Come enjoy Italy to the fullest! Follow the lead of Guide Na with SEVENTEEN, NANA TOUR with SEVENTEEN! PD Na, a 20-year veteran of travel entertainment shows, got a new…",9.3
Youth With You Season 2,Chinese TV Show - 2020,24 episodes,"Cai Xu Kun was the center in ""Idol Producer,"" making his debut in the group, 9 Percent. In this upcoming season, Cai Xu Kun replaces Lay as the PD. The mentors for this season are: Lisa (from girl group Blackpink) ,…",8.4
To Do X TXT,Korean TV Show - 2020,144 episodes,"The first-ever, original variety show featuring TOMORROW X TOGETHER and their bubbly personalities off the stage!

(Source: Weverse official Twitter)",9.0
BTS GAYO,Korean TV Show - 2015,15 episodes,"BTS Gayo is a South Korean show by the boy band BTS. The show is all about BTS doing activities linked to K-Pop.

(Source: BTS Wiki)",8.5
Roommate Season 2,Korean TV Show - 2014,26 episodes,"A new season of Roommate was announced following the departure of several members. This season's concept is Home share, Whole share, where the members not only live together but learn and share from each other. The new…",8.2
BLACKPINK House,Korean TV Show - 2018,12 episodes,"BLACKPINK House will follow the four members of BLACKPINK as they move into their new dorm, where they’ll be spending 100 days of vacation.",8.7
Show!terview with Jessi,Korean TV Show - 2020,95 episodes,"Jessi is a Korean-American rapper and singer who brings a new style of talk show to South Korea. She is cheerful, straightforward, bold and witty with the hottest singers, actors and personalities in the industry. Jessi…",8.8
Run BTS! 2022 Special Episode: Telepathy,Korean TV Show - 2022,2 episodes,"""Run BTS!"" is back after a 10-month break! In this special two-part episode, BTS play a series of ""telepathy games"" to test how in tune they are with each other.

(Source: Wikipedia)",9.2
Monsta X - Ray Season 1,Korean TV Show - 2017,6 episodes,Monsta X's variety show where in episode they have different challenges.,8.9
BTS in the Soop Season 2: Behind The Scene,Korean TV Show - 2021,6 episodes,The behind the scenes of BTS TV show BTS IN THE SOOP Season 2.,9.1
Merry Queer,Korean TV Show - 2022,9 episodes,"Marry Queer' features the stories of queer couples on their ""coming out"" journeys, whether it be revealing their ""unconventional"" relationships to families, friends, or the world. 

(Source: allkpop.com)",8.2
Peak Time,Korean TV Show - 2023,11 episodes,"Idols who have lost their group due to the pandemic or have disbanded due to problems with idol companies, but even idols who want to prove their skills to the world and rookie idols who need a fame booster. A new boy…",8.4
American Hustle Life,Korean TV Show - 2014,8 episodes,"BTS American Hustle Life is a reality show with the BTS members, they were thinking they were going to the US to travel for a new album, but they found out they were training with their new hip-hop tutors, Coolio and…",8.4
Let's BTS,Korean TV Show - 2021,1 episodes,"Hosted by Shin Dong Yup, the show features a never-before-seen, up-close and personal side of BTS, shown across a variety of different segments. BTS have a chance to honestly open up about their careers in interviews…",9.0
I Live Alone,Korean TV Show - 2013,580 episodes,"This program is to recollect the daily lives of celebrities and form its unique sympathies among the singles within South Korea by showing celebrities' lives without significant filtering.

(Source: MyDramaList)",8.4
Monsta X - Ray Season 2,Korean TV Show - 2017,8 episodes,“We’re prepared to show a variety of images that we weren’t able to show through the first season. Viewers can anticipate a fun show.” - Monsta X,8.9
Queendom Season 2,Korean TV Show - 2022,10 episodes,"Following the success of “Queendom” in 2019, a fresh group of six all-female acts at various stages of their careers heads to the stage to duke it out in the musical arena. Only one group can become the “queen”…",7.6
Master Key,Korean TV Show - 2017,13 episodes,"The top stars will become attractive game players in order to participate in upgraded games, which are different from the former ones in other TV shows. All the players should find those who have the master keys, reasoning…",8.1
Coffee Friends,Korean TV Show - 2019,10 episodes,"A variety show that follows Yoo Yeon Seok and Son Ho Jun as they run a cafe in a tangerine farm on Jeju Island, with their profits being donated to charity. The show was inspired by the two close friends and their “Coffee…",8.7
Change Days Season 2,Korean TV Show - 2022,16 episodes,"Four couples and a two week trip.
What's the happy ending that those on the brink of breakup will choose?

A familiar excitement and flutter, what will be their choices?

(Source: Kakao TV)",7.8
It’s Dangerous Beyond the Blankets,Korean TV Show - 2018,10 episodes,"“Homebodies trip of small but definite happiness.” Each of the members is seen enjoying time with music, television, or simply sitting under a blanket.

(Source: Soompi)",8.5
Street Dance of China Season 3,Chinese TV Show - 2020,12 episodes,Overview not available,8.7
Hospital Playlist Goes Camping,Korean TV Show - 2021,6 episodes,"Features the cast of Hospital Playlist going on a two-days-and-one-night camping trip together.

(Source: Soompi)",8.7
Apartment 404,Korean TV Show - 2024,8 episodes,Six residents try to uncover unprecedented incidents and mysteries in apartments in South Korea in this true-story mystery variety show that transcends time and space! Each episode will be based on real events and have…,8.3
EXchange Season 3,Korean TV Show - 2023,20 episodes,The reality dating show EXchange is back with its third season. The show features upheavals of ex-lovers who experience a lot of dating challenges and missions. The participants experience heartbreak as they find new…,7.7
Terrace House: Opening New Doors,Japanese TV Show - 2017,49 episodes,"A group of young people -- including a chef, a snowboarder, and an ice hockey player -- gather in Karuizawa woods while pursuing their dreams. 

(Source: Netflix)",7.9
Going Seventeen,Korean TV Show - 2017,30 episodes,A behind the scenes look at South Korean boy band Seventeen's members.,8.9
New Journey to the West Season 5,Korean TV Show - 2018,5 episodes,"Each member takes one of the characters from the classic Chinese novel “Journey to the West” as they go to different destination every season. In Season 5, Kang Ho Dong, Eun Ji Won, Lee Soo Geun, Ahn Jae Hyun, Mino,…",8.9
