Web Series Name,Original Language - Year of Release,Episodes,Overview,MDL Rating
PhantaCity,Chinese TV Show - 2018,12 episodes,"PhantaCity is a brand new original variety created by Momo's exclusive title, Hunan Satellite TV and Coolbot Culture. He Jiong will be the host of the program, and the famous singer Wang Fei is a guest of the show. The…",7.8
Idol Show Season 2,Korean TV Show - 2008,7 episodes,Overview not available,8.0
Never Say Never,Chinese TV Show - 2021,10 episodes,"""Never Say Never"" is the first boxing experience reality show in the network, 23 boxing enthusiasts from all walks of life, including Olympic champion, university professor, model, singer, film and television actor,…",7.9
Hideaki Anno: The Final Challenge of Evangelion,Japanese TV Show - 2021,2 episodes,"EVANGELION is coming to an end. NHK spent 4 years with exclusive access to director Hideaki Anno, documenting the creative process behind the final EVANGELION film. For the first time, the camera is allowed inside Anno's…",8.0
Twice TV: School Meal Club Reloaded,Korean TV Show - 2020,3 episodes,Twice's maknae line are back with a new show for their school meal club.,8.0
Blue Blue Sky,Chinese TV Show - 2020,8 episodes,"""Blue Blue Sky"" is a variety show with the seven members of S.K.Y. During the journey they focus and learn about environmental protection, experience marine protection work, and strengthen their own environmental awareness.",8.0
Gaki no Tsukai No Laughing Batsu Game: Go To Las Vegas - Hotels and Casino,Japanese TV Show - 2020,1 episodes,The Gaki no Tsukai cast participate in the 18th annual punishment game for a New Year's Eve Special.,8.0
OXQKRAB,Thai TV Show - 2020,4 episodes,The OXQ's members are taking part in a game show where the members will have to challenge each other in different mission.,7.9
Sing and Stay Season 2,Korean TV Show - 2020,9 episodes,"'Sing Stay' is a music live show where talented idol musicians come to visit a guest house to talk about their music and perform live.

(Source: Allkpop)",8.0
Magic Eyes Challenge,Thai TV Show - 2022,4 episodes,Six stars go on an adventure with this fierce competition making use of Isuzu's new D-Max Magic Eyes. They'll fight to earn money for the Road Safety Policy Foundation and win the final trophy. (Source: MyDramaList),8.0
Our Daughter's Boyfriends,Chinese TV Show - 2019,6 episodes,"A Chinese variety show produced by Tencent Video that focuses on four pairs of father and daughters, observing and learning about the dating, relationship and love lives of their daughters! These pairs included Qin Pei,…",7.9
Seoul Check-in Season 2,Korean TV Show - 2022,5 episodes,Kim Tae Ho returns with a new show featuring Lee Hyo Ri. Her easy-going and cool personality can be fully seen as she makes a visit to Seoul every week from Jeju Island. She visits the hottest places in Seoul and meets…,8.0
Law of the Jungle in Papua New Guinea,Korean TV Show - 2016,8 episodes,"The program shows the survival of 25th generation of Byung Man's Tribe in Papua New Guinea, a mysterious land with a variety of natural mysteries ranging from the Amazon jungle to the alpine zone and active volcanoes.…",8.0
KAT-TUN  no Sekaiichi Dame na Yoru!,Japanese TV Show - 2012,17 episodes,"Starting off the New Years of 2012, KAT-TUN go out and experience the most mischievous and naughty night on TV, causing havoc while playing pranks, doing challenges and playing games.",8.0
Right Now It's Girls' Generation,Korean TV Show - 2010,4 episodes,Overview not available,8.0
Nogizaka Doko e,Japanese TV Show - 2019,20 episodes,A TV Show following 4th Gen Nogizaka to various location.,8.0
We Are Siblings,Korean TV Show - 2016,2 episodes,"Famous siblings are required to spend 48 hours together. During those hours, siblings will have to complete different missions that they are given.",8.0
Law of the Jungle in Caribbean,Korean TV Show - 2013,10 episodes,Overview not available,8.0
Campus Go,Chinese TV Show - 2022,10 episodes,"It presents the collective appearance of Chinese post-00s college students and creates the strongest competition among college dance clubs. 

(Source: Chinese = jiuzyoung.com || Translation = MyDramaList)",8.0
SS501 Thank You for Waking Me Up,Korean TV Show - 2005,7 episodes,SS501 Thank You for Waking Me Up is a hilarious show that was presented by Park Kyung Lim waking up SS501 members early in the morning. It started recording in 2005 end and continued to 2006 start marking the New Year…,7.9
I.O.I's Mysterious City,Korean TV Show - 2016,10 episodes,Overview not available,8.0
Love White Love Animal,Thai TV Show - 2020,3 episodes,Overview not available,8.0
Yacht Expedition: The Beginning,Korean TV Show - 2020,10 episodes,A program that depicts the challenge of yachting to those who don't even know the 'ya' of yacht.,7.9
NogiBingo! 8,Japanese TV Show - 2017,11 episodes,"Eighth Season of NogiBingo!
With Third Generation Members (3期生)",7.9
4 Wheeled Restaurant Korea,Korean TV Show - 2020,10 episodes,"A spin off of “4 Wheeled Restaurant”, this time a new team consist of celebrities and professional chef open their restaurant in South Korea but instead of the usual food truck, they will delivered the foods right…",8.0
Crazy Recipe Adventure,Korean TV Show - 2021,20 episodes,Find a recipe out of the world that will satisfy your demanding taste buds! A program in which 4 'Fresh MC Corps' meet the culinary masters of the nation in search of unusual recipes with a theme of different dishes.,8.0
2NE1 TV: Season 1,Korean TV Show - 2009,10 episodes,"A TV show about the girl-band 2NE1. Showing their lives, training time, holidays trip, music recording and many else.",7.9
Naminori! Junny,Japanese TV Show - 2016,25 episodes,"Every third Friday, the members of Johnny's WEST focus on the unknown work and everyday life of their generation. ""Génie"" is a ""genius"" in French. Therefore, they are focusing on young geniuses and their talents. In…",7.9
Love at First Song,Korean TV Show - 2019,8 episodes,XtvN’s “Love at First Song” features people being matched up in pairs to rehearse and perform a duet together. The twist is that they have to prepare and perform without seeing each other’s faces. Once they find…,7.7
Law of the Jungle with Friends,Korean TV Show - 2015,8 episodes,Overview not available,8.0
Problematic Men Season 3,Korean TV Show - 2019,13 episodes,"Season 3 features the theme of Brain Wanderers Squad/Travelling Brainiacs where the cast goes outdoors, unlike most of the previous 2 seasons when they were in the studio. The 6 cast members travel to various places…",7.9
Got Ya! GWSN,Korean TV Show - 2018,10 episodes,"Mnet will be launching a reality program with a new format for Kiwi Media Group’s upcoming girl group GWSN. GWSN is short for the group’s Korean name, “Gong Won So Nyeo,” which is a combination of the Korean…",8.0
Survivor Philippines: Celebrity Showdown,Filipino TV Show - 2010,71 episodes,"The show follows the same general format as the other editions of the show. The castaways are split between two or three ""tribes"", are taken to a remote isolated location and are forced to live off the land with meagre…",8.0
The Face Thailand: Season 5,Thai TV Show - 2019,13 episodes,Overview not available,8.0
INTO THE LIGHT with NINE BY NINE,Thai TV Show - 2018,4 episodes,A music program where the members of 9x9 perform covers on famous Thai and international hits.,8.6
The Ultimate Watchlist Season 2,Korean TV Show - 2019,16 episodes,The final ultra-power program that puts in different corners the latest trendy codes that will transform viewers into the biggest insiders.Second Season Xtvn's variety show The Ultimate Watchlist Of Latest Trends.,8.0
Taste of Love: Season 2,Korean TV Show - 2019,16 episodes,"In the show, a celebrity and non-celebrity date for 100 days, under contract. After the 100 days has passed, the couple decide whether they want to continue dating or not. (Source: Wikipedia)",7.8
4EVE Girl Group Star,Thai TV Show - 2020,13 episodes,"A search for a new Thai girl group called 4EVE (Four Eve) among 20 trainees (trainees) selected from more than 1,000 applicants with outstanding characters. But come together to pursue your dream of staging that is not…",7.8
Boystory Instruction Book,Chinese TV Show - 2018,10 episodes,This series follows Boystory and their predebut journey.,8.0
Super Brain Season 7,Chinese TV Show - 2020,12 episodes,Super Brain: Ignite Your Brain Season 3 returns with another slight change in the show's format. The top 100 scorers from the show's mental ability application test still take part as contestants in finding the Brain…,7.9
Suddenly a Millionaire,Korean TV Show - 2017,7 episodes,"Guests are lent 1 million won (S. Korean currency) and are asked, ""How are you going to use it?"" With an additional million won to spend, the guest's spending patterns, lifestyles, personal tastes, and values are observed.…",8.0
Kanjani Chronicle,Japanese TV Show - 2015,236 episodes,"In this program members of the Kanjani8 who are very active in various fields, will challenge in projects, interact with new people, sweat together, and create a new side of them. The show will depict their growth as…",7.9
GameCenter CX: Season 14,Japanese TV Show - 2010,11 episodes,"Videogame variety show in which the host, Shinya Arino, is challenged with playing several games from previous eras.",8.0
Flavorful Origins: Guiyang,Chinese TV Show - 2021,10 episodes,"This season of Flavorful Origins takes us to Guiyang, the capital of Guizhou Province in Southwest China. The city which's surrounded by mountains and forests, has thousands of years of history, rich natural resources,…",8.0
Get It Beauty Talk+,Korean TV Show - 2021,16 episodes,Overview not available,8.3
Shindong Gayo,Korean TV Show - 2020,19 episodes,Overview not available,7.9
Yuan Ren Quan Nian Wu Xiu Ji Hua,Chinese TV Show - 2023,2 episodes,Overview not available,7.6
Rising Land Season 2,Chinese TV Show - 2023,13 episodes,"""Chaoyang Dage Center"" is a music-type song-playing program that uses music to meet friends. ""Chaoyang"" means the newborn sun. The show wants to convey the beautiful vision of contemporary young artists for music through…",8.0
A Day Trip with the Dive Family,Korean TV Show - 2023,3 episodes,"The most chaotic yet funniest show at DIVE Studios is here! Join us for a day trip with the DIVE Family: ASHLEY CHOI, BM, JAMIE, JUNNY, and PENIEL ! 

(Source: DIVE Studio)",8.0
Kep1er DOUBLAST on Air,Korean TV Show - 2022,1 episodes,"Kep1er, who returned with their second mini album ""DOUBLAST,"" their new title song ""Up!"" will be performed for the first time, as well as their debut song ""WA DA DA"" that was loved by global fans. Kep1er's summer camping…",8.5
Han Moon Cheol's Dashcam Review,Korean TV Show - 2022,114 episodes,Lawyer Han Moon Cheol examines black box tapes of car accidents or dangerous situations while driving and provides his expert opinion and discusses the incidents with the other hosts to prevent them in the future. (Source:…,8.8
LAZ iCON,Thai TV Show - 2021,12 episodes,"Thirty-five trainees and artists both signed with entertainment companies and freelance compete to climb the ranks in this survival show. The top five icons debut as a five-member boyband. 

(Source: MyDramaList)",8.1
Music Bank in Jakarta,Korean TV Show - 2017,1 episodes,"The Music Bank World Tour is a worldwide live concert tour of South Korean music show Music Bank by the KBS. The tour stages live performances, featuring multiple K-pop acts, in various locations outside of South Korea.…",7.9
Hoody's Home Dining,Korean TV Show - 2021,8 episodes,Hoody welcomes fellow artist inside her home to enjoy a home-cooked meal she prepared. Hoody and her guest chat over dinner.,8.0
Youth Party,Chinese TV Show - 2021,11 episodes,"Youth Party is a spin-off show based on Youth With You 3, and it is based on the stylish and cool lifestyle of young people. The program takes 12 real life scenarios of youth as its theme, and designs games associated…",8.0
Perhaps Love: Season 4,Chinese TV Show - 2017,11 episodes,"Celebrities pair up, live and and work together as they learn about other people and the love in their lives.",7.8
Beauty & the Babes Season 2,Thai TV Show - 2019,6 episodes,"Presented by Jane Ramida, Gun and Off will train three boys and three girls to face a contest in which two of them can be new members of GMMTV.",8.0
The Face Men Thailand Season 1,Thai TV Show - 2017,10 episodes,"A reality modelling competition. Eighteen contestants live together in the Artemis Elite residence. Every week, they're trained by their regular coaches and special guests. 

(Source: MyDramaList)",7.9
Kiss,Korean TV Show - 2019,4 episodes,"KISS follows nine vocalists trying to find their perfect match to do a duet. From a boy band member, rappers, a rocker, K-pop singers to classically-trained singers, they have to blend different styles and make unforgettable…",8.0
Idol Picknic: (G)I-DLE,Korean TV Show - 2020,2 episodes,Overview not available,8.0
The Devil Wears Jung Nam,Korean TV Show - 2020,11 episodes,"Ask for mu 'clothes' Eden. Original Fashionista Bae Jung Nam will solve your clothes concern!
Baejeongnam x Jo Jae Yoon's won and only concern customized clothes shop open!",7.9
4 Wheeled Restaurant China,Korean TV Show - 2018,10 episodes,"A Korean chef who specializes in Chinese cuisine and celebrity cast members set out to China to try their hands at cooking for locals. On a humble food truck, they travel around China and cook food that is affordable,…",8.0
Try It,Korean TV Show - 2019,10 episodes,"“Try It” is a variety show made for those who are preparing for jobs or planning on changing jobs. Several celebrities, who make up for their weaknesses with their passion and determination, will experience a variety…",7.9
Cougar on the Prowl,Thai TV Show - 2016,16 episodes,"Comedy talk show where ""an auntie is hiring new faces who wanna work in her company as a star"".",7.9
Fun! Fun! Fantastics Season 1,Japanese TV Show - 2021,6 episodes,"The members of FANTASTICS from Exile Tribe learn about the culture of the 80s and 90s through sets, costumes, and covers of famous songs. Featured guests are legends who were influential during that era, such as LL BROTHERS,…",7.9
Gaki no Tsukai No Laughing Batsu Game: Hotel Employee,Japanese TV Show - 2009,1 episodes,"For the third consecutive time, Yamazaki, Downtown, and Cocorico took part in the annual punishment game. The setting was a hotel and it aired on New Year's Eve at 6:30pm until 12:30am on New Year's Day. Numerous cameo…",8.0
Sisters Who Make Waves Season 4,Chinese TV Show - 2023,12 episodes,Overview not available,7.9
All Kinds of INTO1: To the Sea,Chinese TV Show - 2022,8 episodes,"11 young men from different countries with different cultures are just like 11 independent islands. During this rare holiday, they will play small games with mutual understanding and cooperation. Through personal operations,…",8.4
Korea Coast Guard,Korean TV Show - 2018,5 episodes,"Four celebrities try their luck at being a maritime police officer and help solve any problem in the Busan see along with the Korea maritime police.

(Source: MyDramaList)",7.9
The Swan Club: Pilot,Korean TV Show - 2017,2 episodes,"""Swan's Club"" is a ballet-themed Chuseok special focusing on the healing powers of ballet class.",7.9
Seaside Band,Chinese TV Show - 2022,12 episodes,Overview not available,8.0
The Great Wall,Chinese TV Show - 2020,13 episodes,"""The Great Wall"" is the world's first Great Wall cultural experience program. Celebrities joined the program as brick members, under the leadership of ""guide"" Zhang Shao Gang, formed the ""Great Wall Research Group"",…",7.9
Replies That Make Us Flutter,Korean TV Show - 2016,2 episodes,Overview not available,7.9
The Game Caterers Special 9,Korean TV Show - 2023,2 episodes,"Special edition of ""The Game Caterers Season 2"" with comedians.

(Source: MyDramaList)",7.8
World Date with SHINee,Korean TV Show - 2013,3 episodes,A few fans from all over the world are chosen to travel to South Korea and meet Key and Jonghyun.,7.9
Super Idol: Season 1,Chinese TV Show - 2015,13 episodes,Super Idol gathers 25 talented Chinese and Korean boys to South Korea to participate in a two-year idol training program. The winning students would eventually be combined to form a group as singers and actors to debut…,7.9
With You Along the Way Season 2,Chinese TV Show - 2016,12 episodes,"With You Along the Way Season 2 will return to the screen in March 2016. This season, apart from Zhang Zhilin (Julian Cheung) & Yuan Yongyi (Anita Yuen), who will continue their super popularity in the first season,…",7.9
My Little Television Season 1,Korean TV Show - 2015,101 episodes,The program is formatted in the form of a competition between main casts based on their internet broadcasting performance.,7.9
Ristorante Coreano,Korean TV Show - 2019,7 episodes,"After living in South Korea for more than ten years, Italian native, Alberto Mondi, decides it’s time to return home, but he’s taking a bit of Korea with him.

(Source: Viki)",7.9
HaKaTa Hyakkaten Season 2,Japanese TV Show - 2013,8 episodes,Overview not available,7.6
Perhaps Love: Season 1,Chinese TV Show - 2014,13 episodes,"Celebrities pair up, live and and work together as they learn about other people and the love in their lives.",7.7
Who's the Murderer Season 8 Pilot,Chinese TV Show - 2023,1 episodes,Overview not available,7.8
Law of the Jungle,Chinese TV Show - 2016,12 episodes,"Adapted from Korean Tv format ""Law Of The Jungle"" and taking place in  Madagascar jungle, Vanuatu.",7.8
Hinatazaka de Aimashou,Japanese TV Show - 2019,300 episodes,"A Japanese variety show starring Hinatazaka46 and is hosted by Japanese comedy duo Audrey. Originally it was Hiragana Oshi but due to Hiragana Keyakizaka46 becoming Hinatazaka46, the program has now been renamed.",8.0
Oh! My Baby,Korean TV Show - 2014,125 episodes,A reality show which follows the lives of four celebrity families with children.,7.9
Love Naggers Season 1,Korean TV Show - 2018,26 episodes,"“Is love always beautiful and romantic?” Our answer is NO. If you look around, you can easily find endless fights of the power game between lovers, poor souls who were taken advantage of, unbelievably crazy text…",7.9
AKB48 Nemousu TV: Season 17,Japanese TV Show - 2014,11 episodes,Overview not available,7.9
Delivery Food Grounds,Korean TV Show - 2020,11 episodes,Overview not available,7.9
Wan(der) Day: Mile,Thai TV Show - 2022,1 episodes,"Mile shows us what he will do for a day.

(Source: MyDramaList)",7.9
Ride on Time Season 5,Japanese TV Show - 2022,19 episodes,"""Ride on Time"" takes you backstage into the world of Japan's top boy bands - Johnny's. In this documentary series, we follow Johnny's members and show you what their work is really like.

(Source: Amazon Prime)",7.9
Krahai Lao,Thai TV Show - 2021,25 episodes,"Tay was a shy kid. In elementary school, he had few friends and didn't dare initiate conversations, afraid of the dead air he would often encounter. In secondary school, he became more talkative, but only with his close…",7.9
HaKaTa Hyakkaten Season 3,Japanese TV Show - 2015,12 episodes,In HaKaTa Hyakkaten 3-Gokan the guest changed from members to people from the entertainment business who don't know or don't have any interest in HKT48. Each episode also has an extra segment called HaKaTa Hyakkaten…,7.9
Love or Friendship,Korean TV Show - 2023,8 episodes,"“Is it friendship or love?” An old school group blind dating program in which college students who are friends in real life come together to find love. The friends form a team of four, and a total of four teams spend…",7.8
Wow! Nice Figure Season 2,Chinese TV Show - 2020,12 episodes,"The program truly records the living conditions, eating habits, and exercise habits of each guest. The stars observe with the other guests and watch their different lifestyles! All about being healthy and leading a good…",7.9
XG's Three Meals a Day,Korean TV Show - 2023,6 episodes,"Global girl group XG goes on a four nights and five days trip to the Korean country side during which they complete missions given by the staff and play games.

(Source: MyDramaList)",8.4
Documental Season 6,Japanese TV Show - 2018,4 episodes,"Produced by Hitoshi Matsumoto, Documental pits ten comedians against each other. The objective is to make each other laugh in a closed room. Each contestant brings a one million yen participation fee. The last person…",7.9
Star Chaser Season 1,Chinese TV Show - 2021,12 episodes,"In the program, the urban crowd briefly escapes from the city life and its comfort to enjoy the quietness of the countryside with their friends, and pursue the ultimate relaxed life. (Source: Chinese = Douban || Translation…",7.8
Kep1er Zone Season 3,Korean TV Show - 2023,10 episodes,Overview not available,8.1
Me to Us,Chinese TV Show - 2020,13 episodes,"With three collaborators, they will search and cultivate new and upcoming musicians to form a band at the end of the show through various performances. ""Our Band"" is jointly produced by Mango TV and Yuanjing Film and…",7.9
Human Intelligence – The Most Perfect A.I.,Korean TV Show - 2018,2 episodes,"“Human Intelligence” is a sci-fi variety show about futuristic, cutting edge artificial intelligence that launches with the question, “What happens when human intelligence (the closest type of artificial intelligence…",7.9
Wild Kitchen Season 1,Chinese TV Show - 2018,12 episodes,"The cast travels to various ""wild fields"" to find wild foods with regional characteristics and restore the original taste of life with original ingredients and cooking methods. In the awakening of the wildness of people…",7.9
NMB48 Geinin!!! 3,Japanese TV Show - 2014,12 episodes,NMB48 Geinin!!! 3 is a 3rd Season of TV Show NMB48 Geinin! featuring the members of NMB48. The program aired 12 episodes between July and September 2014.,7.7
Workman Season 2,Korean TV Show - 2022,90 episodes,"Jang Sung Kyu takes on new part-time jobs again.

(Source: MyDramaList)",8.7
No Way Home,Korean TV Show - 2024,12 episodes,Girls' Generation Sunny and Hyo Yeon go on a winter camping trip! A new concept camping entertainment that invites guests to have honest conversations and even share camping-related tips! (Source: Korean = jTBC || Translation…,8.3
HKT48 Tonkotsu Mahou Shoujo Gakuin,Japanese TV Show - 2013,12 episodes,Nogizaka46 x HKT48 Crown Program Battle,7.9
Falling in Love Like a Romantic Drama in New York,Japanese TV Show - 2022,12 episodes,Overview not available,7.9
Hiragana Oshi,Japanese TV Show - 2018,50 episodes,"Hiragana Oshi is a Japanese television variety show starring Japanese idol girl group, Hiragana Keyakizaka46 and is hosted by Japanese comedy duo Audrey.",7.9
Gaki no Tsukai SP: 24-Hour Tag,Japanese TV Show - 2000,1 episodes,"A batsu game that took place over the period of 24 hours where all the cast, except Matsumoto, are locked in a sports arena, playing ""tag"" with various Oni (demons) that were ""summoned"" to attack at random moments, each…",8.0
Blinding Bling Evershaw - U-KISS Vampire,Korean TV Show - 2010,10 episodes,The show aims to show the psychological differences between blood types.,7.9
Grandsons the Reality Project,Thai TV Show - 2020,4 episodes,"We follow the journey of the ""Grandsons"", a band consisting of actors under GMMTV, during a three-day trip. We'll see the hardships and obstacles they will encounter along the way as they take a step further in the process…",7.9
NogiBingo! 7,Japanese TV Show - 2016,12 episodes,Seventh Season of NogiBingo!,7.9
De Yun Dou Xiao She Season 2,Chinese TV Show - 2021,20 episodes,A reality show focusing on Chinese crosstalk.,7.9
United Fathers Pilot,Korean TV Show - 2022,2 episodes,United Fathers is a family reality show featuring dads/foreigners raising children in South Korea. It observes the fathers' unique ways of caring for their children and shares the experiences and knowledge of raising…,7.9
&Audition - The Howling: Japan Summer Vacation,Japanese TV Show - 2022,2 episodes,"The &audition members go on a summer vacation in Japan as a gift for working hard on preparing for the final episode of &Audition The Howling.

(Source: MyDramaList)",8.2
I'll Win You Over With My Channel,Korean TV Show - 2018,23 episodes,"Unlike other variety shows, “We Will Channel You” is a program where the guests become creators, create content based on their own ideas & try to gain as many subscribers and views as they can.",7.9
Boys Cooking,Thai TV Show - 2020,14 episodes,Members of the Superboy Project are cooking.,8.0
Girls Like Us,Chinese TV Show - 2021,10 episodes,"""Girls Like Us"" brings together girls with extreme personalities and diverse backgrounds, to freely choose members to form a label; and perform competitions on the label, and finally the ""China Top 1 Girl Label"" is born.…",7.9
Get It Beauty 2017,Korean TV Show - 2017,43 episodes,Korea's top beauty program invites celebrities and make-up artists to share their favorite make-up products and beauty secrets.,8.1
4 Things Show Season 1,Korean TV Show - 2014,18 episodes,“4 Things Show” is a star documentary that shows a person with four perspectives through interviews with the star himself and 3 people around him. Dig into the life of the star like you have never been seen before!…,7.9
Snowball Project,Korean TV Show - 2017,72 episodes,"This TV show serves as a collaboration between SM Entertainment and Mystic Entertainment, where their musicians work together on making new music.",7.9
