Web Series Name,Original Language - Year of Release,Episodes,Overview,MDL Rating
Be With You Season 2,Chinese TV Show - 2021,10 episodes,"Siblings from season 1 as well as new siblings will join season 2 of ""Be With You."" This show is about how brothers have a huge age gap with their younger sister. Brothers tend to be busy with their work, but this show…",8.5
Seoul Check-in Season 1,Korean TV Show - 2022,6 episodes,Kim Tae Ho returns with a new show featuring Lee Hyo Ri. Her easy-going and cool personality can be fully seen as she makes a visit to Seoul every week from Jeju Island. She visits the hottest places in Seoul and meets…,7.9
VIXX's One Fine Day,Korean TV Show - 2015,8 episodes,Popular idol travel variety show. VIXX is heading to Jeju island to rest and do to some challenges.,8.3
aespa’s Synk Road,Korean TV Show - 2022,12 episodes,"aespa, the fourth-generation girl group that represents Korea, starts its first reality travel show. The first travel spots of the Synk Road are Gangwon's East Sea and Pyeongchang. Throughout the trip, the members must…",8.3
Jaechan's Dream,Korean TV Show - 2022,193 episodes,"Time for precious conversation for everyone who dreams. This time, it's a dream for you and me.

(Source: Korean = now.naver.com || Translation = MyDramaList)",8.4
The Devil Wears Jung Nam 2,Korean TV Show - 2021,12 episodes,Overview not available,8.3
City Police,Korean TV Show - 2019,10 episodes,"Learn all about criminal investigations with Urban Cop! Urban Cops is a variety show that offers the inside look at criminal investigations, allowing viewers to be a part of nerve-racking missions. Upon completion of…",8.4
Inkigayo,Korean TV Show - 1991,1240 episodes,"The show features some of the latest and most popular artists who perform on stage. It is broadcast from the SBS Open Hall in Deungchon-dong, Gangseo-gu, Seoul.",8.1
Things that Make Me Groove Season 2,Korean TV Show - 2022,14 episodes,Overview not available,8.3
RUN,Korean TV Show - 2020,4 episodes,The show follows the cast as they participate in meet-ups at various runnings spots both in and outside of Korea to experience “the joy of running.” The four actors join forces to become a running crew. After their…,7.7
Lee Mu Jin Service,Korean TV Show - 2022,150 episodes,"""Lee Mu Jin Service"" is a high-quality live content in which MZ generation's representative singer-songwriter Lee Mu Jin, along with other artists, provides the best music service that catches the eyes and ears of music…",8.3
NCT DREAM A Midsummer Day's Dream,Korean TV Show - 2020,3 episodes,NCT DREAM A Mid Summer Day's Dream,8.5
Time to Twice: Twice and the Chocolate Factory,Korean TV Show - 2021,4 episodes,Overview not available,8.3
Friday Night,Korean TV Show - 2020,11 episodes,"“Friday Night,” the new program will consist of six short-form segments with different themes like sports, science, art, travel, cooking, and factories. It will be co-directed by PD Na Young Suk and PD Jang Eun Jung.…",7.9
Ace vs Ace Season 4,Chinese TV Show - 2019,12 episodes,Wang Pai is a large-scale original indoor sports reality show launched by Zhejiang Satellite TV. Each issue surrounds a theme and invites two ace teams. The two team captains lead several popular guests to conduct PK…,8.3
Birds of a Feather,Korean TV Show - 2020,17 episodes,"“Birds of a Feather” is a new variety show where the cast and guests will be divided by their dispositions, and everyone will respect each other’s different tendencies. The first variety show of its kind, it will…",7.9
Heart Signal Special,Korean TV Show - 2017,2 episodes,Participants meet panelists in a studio which discuss behind-the-scenes stories and answer questions from fans.,7.7
Enhypen Comeback Show: Carnival,Korean TV Show - 2021,1 episodes,Enhypen’s 2nd mini album’s comeback show!,8.8
Girls for Rest,Korean TV Show - 2018,74 episodes,"Girls' Generation - Oh!GG's variety show in France to promote their debut single ""Lil' Touch"".",8.3
Don’t Be Jealous,Korean TV Show - 2020,17 episodes,It’s no secret that it’s extremely difficult for celebrities to openly be in a relationship in Korea. “Don’t Be Jealous” looks to normalize this current taboo by talking about what life is like while dating…,7.9
4 Wheeled Restaurant Thailand,Korean TV Show - 2018,8 episodes,This program explores how the cast adapts to different countries as they attempt to run a food truck. They will be going to Thailand for their first overseas adventure.,7.8
Youn's Stay Director's Cut,Korean TV Show - 2021,1 episodes,Overview not available,8.2
A Date with Cha Eun Woo,Hong Kong TV Show - 2019,5 episodes,"Korean celebrities always look good on stage, but do you wonder how they are like when they're off stage? Cha Eun Woo, who built up his popularity through the drama ""My ID is Gangnam Beauty"", recently held his first…",8.0
Love Recall,Korean TV Show - 2022,32 episodes,"What's the destiny with my ex that I have broken up with? For those who can't sleep because of regret or deep regret over their past breakup, men and women who somehow left regrets. A love reality show ""Love Recall""…",7.8
BE-hind Story,Korean TV Show - 2020,1 episodes,Overview not available,8.9
SEVENTEEN in CARAT LAND,Korean TV Show - 2020,1 episodes,"2020 SVT 4th Fanmeeting ""SEVENTEEN IN CARAT LAND"".",8.7
BELIFT LAB - Training Camp,Korean TV Show - 2020,1 episodes,Spin off/special episode for the competitive Kpop reality show: I-LAND,8.4
Who's the Murderer Season 7,Chinese TV Show - 2022,11 episodes,"In a prologue, the cast is introduced to the settings and suspects of a murder case for the new episode. The cast then chooses their role in the episode, as a particular suspect or the detective. Other than the detective,…",8.0
How Well Do You Know Each Other,Thai TV Show - 2018,7 episodes,"Seven ""Y"" couples from GMMTV have to go through a test to see how well they know each other.
This is a special show to promote the Y I Love You Fan Party 2019 concert.

(Source: rosie at MyDramaList)",8.2
Tred Tray Fest with Tay Tawan,Thai TV Show - 2018,13 episodes,Tay Tawan and company visit different festivals around Thailand where they will learn their customs and traditions while having fun.,8.2
Super Nova Games Season 3,Chinese TV Show - 2020,7 episodes,Celebrities in China participate in a sport competition.,7.8
K-pop Star Season 6: Last Chance,Korean TV Show - 2016,40 episodes,"The sixth and final season of the South Korean reality television competition show K-pop Star, also branded as K-pop Star 6: The Last Chance. Changes to the format have been made to the final season, with restrictions…",7.8
Time to Twice: Twice New Year,Korean TV Show - 2021,5 episodes,The seventh season of Time to Twice,8.4
Star Road: MONSTA X,Korean TV Show - 2019,24 episodes,OSEN’s “Star Road” is a program where Korean celebrities showcase charms that haven’t been seen yet or a different side of celebrities than the ones fans know on stage. From casual interviews to real daily life…,8.5
SKZ-LIFE,Korean TV Show - 2020,5 episodes,"Stray Kids members show fans what they do during quarantine, such as exercising and making music.",8.5
Begin Again Season 1,Korean TV Show - 2017,12 episodes,"Reality program where musicians from South Korea travel around the world and hold busking events for people who have no idea who they are. They introduce themselves through their music.

(Source: Wikipedia)",8.0
NCT DREAM Mini Game,Korean TV Show - 2019,3 episodes,Overview not available,8.6
Get Smart! Dad,Chinese TV Show - 2020,12 episodes,"Four celebrity families are taking a trip far from home. While the moms enjoy themselves, the dads need to find them with their kids. The family trip ends up an exciting and joyful adventure. (Source: YOUKU English on…",8.3
Nizi Project Season 2: Part 1,Japanese TV Show - 2023,10 episodes,"A joint boy group project “Nizi Project” by JYP and Sony Music. A global audition held in 11 locations including 8 cities in Japan, Seoul, NY and LA delivered the event of the Tokyo training camp by the members who…",7.8
WayVision Season 2: Winter Sports Channel,Korean TV Show - 2021,12 episodes,Overview not available,8.6
Law of the Jungle in New Caledonia,Korean TV Show - 2016,9 episodes,"The Program shows the survival period of the 26th Byung Man's Tribe in New Caledonia, The most natural environment nearest to heaven. 

(Source: DramaWiki)",8.1
SKZ Variety Games,Korean TV Show - 2022,2 episodes,Overview not available,8.7
Meenoi's Yorizori Season 1,Korean TV Show - 2021,4 episodes,Overview not available,8.2
Drunken Trip with Jin,Korean TV Show - 2022,4 episodes,"Jin embarks on his first variety show journey, along with well-known Korean chef, Baek Jong Won; to learn the process of brewing alcohol, specifically Korean rice wine to preserve and sustain its commercial market, followed…",8.7
Twice TV Season 4,Korean TV Show - 2016,8 episodes,"The show follows the nine members of TWICE — Nayeon, Jihyo, Jungyeon, Mina, Sana, Momo, Chaeyoung, Dahyun and Tzuyu — a South Korean girl group formed by JYP Entertainment, in their idol lifes. The episodes show…",8.0
"Where Are We Going, Dad? Season 5",Chinese TV Show - 2017,13 episodes,"Based on the original South Korean reality show Dad! Where Are We Going?, it features four fathers and one interim father taking their children to rural places and international destinations.",8.3
Twice – Lost:Time,Korean TV Show - 2017,21 episodes,"The show, called 'Lost Time', will have TWICE participating in fantastical missions to find the missing pieces of fairy tales and fables. Kwak Si Yang will be taking on his first ever MC role for the show, acting as…",8.3
Fighting Man,Chinese TV Show - 2016,13 episodes,Participants must complete missions given to them by phone by mysterious director Hao.,7.9
Risqué Business: Taiwan,Korean TV Show - 2023,5 episodes,"Shin Dong Youp and Sung Si Kyung embark on a laughter-filled journey to Taiwan, aiming to gain a deeper understanding of its sex culture and business.

(Source: Netflix)",7.7
Stray Kids: Stay in Playground,Korean TV Show - 2020,1 episodes,"A special film included with Stray Kids' second photobook, ""Stay in Playground"".",8.4
Real Now - Ateez,Korean TV Show - 2022,7 episodes,Overview not available,8.7
Divas Hit the Road Season 5,Chinese TV Show - 2023,14 episodes,Overview not available,8.4
Tomorrow x Together Welcome Back Show,Korean TV Show - 2019,1 episodes,"The five member K-Pop group 'Tomorrow x Together' host a comeback show after releasing their first album 'The Dream Chapter: MAGIC'.

(Source: MyDramaList)",8.7
Sisters Who Make Waves Season 1,Chinese TV Show - 2020,13 episodes,"The variety program shows the process of different women (age 30+) chasing their dreams, with the realistic dilemma and balanced choices related to it, allowing the viewers to reflect on their choices and dreams in the…",7.7
Midnight Horror Story Season 1,Korean TV Show - 2021,47 episodes,"The hosts read the scariest horror stories submitted by the public, searching for the best horror storyteller with the spookiest story winning a final prize of 444,444 won. 

(Source: HaEl987 at MyDramaList)",8.2
Stray Kids: Stay in London,Korean TV Show - 2019,1 episodes,"The making of film for Stray Kids' first photobook, ""Stay in London"".",8.3
Show!terview with Sunmi,Korean TV Show - 2022,41 episodes,Overview not available,7.8
The Idol Ramyeonators,Korean TV Show - 2022,10 episodes,"Na PD X TREASURE! 5-minute variety show ‘Idols Who Cook Ramyun’ featuring TREASURE Choi Hyun Suk and Park Ji Hoon.

(Source: The Seoul Story on Twitter)",8.4
Time to Twice: Tdoong Entertainment Season 2,Korean TV Show - 2021,5 episodes,This season of Time to Twice will be a continuation of Twice members working in an office for an Entertainment company.,8.4
BTS China Job,Chinese TV Show - 2014,3 episodes,"""BTS China Job"" is a Yinyuetai special TV broadcast documentary about BTS spending three days in China.

(Source: bts.fandom.com)",8.6
Chen Le & Ji Sung's This and That Season 1,Korean TV Show - 2018,22 episodes,"""Chen Le & Ji Sung's This and That"" also known as ""ChenJi's This and That"", is a show where we get to see Chen Le and Ji Sung try new things. Their videos are bound to make you happy as they explore different new things…",8.7
Takes a Real Man Season 2,Chinese TV Show - 2016,14 episodes,Takes a Real Man is a variety show featuring eight celebrities as they experience life in the Chinese military.,8.4
Tomorrow x Together Comeback Show: Eternity,Korean TV Show - 2020,1 episodes,"The five member K-Pop group Tomorrow x Together host a comeback show for their third mini album 'The Dream Chapter: ETERNITY'.

(Source: MyDramaList)",8.7
Unnies Are Running: Witch Fitness Basketball Team,Korean TV Show - 2022,14 episodes,"Depicts the basketball challenges of 8 stars who built walls against sports for various reasons.

(Source: Naver)",8.0
Girls' Generation's Horror Movie Factory,Korean TV Show - 2009,6 episodes,"Girls' Generation's Horror Movie Factory, commonly abbreviated to ""H.M.F"", is an MBC variety TV show starring the South Korean girl group Girls' Generation. The members (excluding Yoona who was not present during filming…",7.8
Time to Twice: Yes or No,Korean TV Show - 2021,4 episodes,"In this season of ""Time to Twice,"" Twice members will have a relaxing time if they make the good choices.

(Source: Hicka at MyDramaList)",8.6
The Next 2023,Chinese TV Show - 2023,10 episodes,"26 performers, who are at different stages in their music careers as well as in life, step up on stage to perform as their authentic selves. Through different challenges, they compete against the others to earn a spot…",7.6
Dong Dong Shin Ki,Korean TV Show - 2020,15 episodes,"JTBC's 'Knowing Brothers' will be launching a new mini segment, 'After School Activities' both via TV and YouTube. Through 'After School Activities', the 'Knowing Brothers' cast members will have a chance to take lessons…",8.0
Song Ji Hyo's Beauty View,Korean TV Show - 2017,10 episodes,"Ordinary people are invited as the makeup models on the show. The professional makeup artist uses her brushes and works wonders to show viewers about the fascinating beauty world. 

(Source: Wikipedia)",8.0
Bu:QUEST of NCT DREAM,Korean TV Show - 2020,8 episodes,Overview not available,8.5
The Next NEO Model,Korean TV Show - 2021,3 episodes,"Editor in chief, model and photographer Johnny, with his muse, supermodel Jungwoo, are in search for the new face for ""Johnnyzed"". The models (NCT 127) are competing to become the next cover boy. aka NCT 127's parody…",8.4
K Food Show: A Nation of Broth,Korean TV Show - 2022,3 episodes,"If there’s anything Ryu Soo Young, Ham Yon Ji and Huh Young Man have in common, it's their love for good food. In ""K Food Show: A Nation of Broth"", the trio travel around South Korea on a ‘broth journey’, trying…",8.0
Arashi ni Shiyagare,Japanese TV Show - 2010,460 episodes,"The five program hosts are not informed about what will happen in the show prior to taping and are expected to improvise on the spot. All they need to do is perform, without preparation, a wide variety of entertaining…",8.4
Sign Here,Korean TV Show - 2019,10 episodes,"“Sign Here” aims to discover artists with wide-ranging talent — including rap, vocal, producing, and performing — to lead the next generation of hip hop in Korea as the newest member of AOMG. (Source: Soompi)",7.9
ATEEZ: The Curse of the Money Hole,Korean TV Show - 2022,13 episodes,"After getting their license back from ESC, ATEEZ, the space pirate group, receives a special mission to 'find the topping stone hidden in the pirate island' and shows the journey to the infamous pirate island. (Source:…",8.6
The Play: The Boyz House,Korean TV Show - 2018,4 episodes,The Boyz reality show.,8.4
TayNew Meal Date Special,Thai TV Show - 2020,17 episodes,Special episodes from the original TayNew Meal Date show.,8.5
TXT Episode,Korean TV Show - 2019,114 episodes,Overview not available,8.7
Idol Level Up!,Korean TV Show - 2020,4 episodes,"A project by the K-Pop group ATEEZ, who will learn new things from child prodigies.

(Source: MyDramaList)",8.6
Youth Periplous Season 4 Pilot,Chinese TV Show - 2023,1 episodes,Overview not available,8.1
Law of the Jungle in Nicaragua,Korean TV Show - 2015,8 episodes,Overview not available,8.2
Sum+fing,Korean TV Show - 2022,10 episodes,"""Sum+fing"" where hot men and women that have a interest in surfing gather together. An intense dating reality program where they live together to find true love. (Source: Korean = 홀인러브 Hole in love Part 1 YouTube…",7.1
Super Intern,Korean TV Show - 2019,9 episodes,"“Super Intern” is a new program that will select interns based only on a SWOT analysis (study looking at the company’s strengths, weakness, opportunities, and threats) without looking at the applicant’s age,…",7.6
Meeting You,Chinese TV Show - 2019,12 episodes,"The program selected seven single young people to stay in a romantic and beautiful residence and they will live together in the same house for 30 days. From seeing each other, to knowing each other, they approach each…",7.8
Hit It Off,Chinese TV Show - 2023,10 episodes,"“Hit It Off” is a captivating reality show that pairs up actors to undergo intensive training and enhance their acting skills. Over a dozen talented young actors coexist in a shared living space, showcasing to the…",7.6
Vampire House: The Favorite,Korean TV Show - 2021,2 episodes,"Everyone from the NCT 127's Vampire House wants to become human for the person they love. They gather to discuss and play games and the winner will drink the family treasure - the wine ""Favorite"", which got the power…",8.6
Sim For You Season 2,Korean TV Show - 2019,33 episodes,"“Sim For You” is a reality series that chronicles each EXO member’s life and reveal stories from their everyday life as a series.
The second season will follow Chen and his busking adventures.",8.6
Falling in Love Like a Romantic Drama Season 3,Japanese TV Show - 2019,12 episodes,"A reality TV show, hosted by Watanabe Naomi, that follows 8 young actors and actresses performing kiss scenes for dramas.

(Source: MyDramaList)",7.6
Lee Soo Geun: The Sense Coach,Korean TV Show - 2021,1 episodes,"Lee Soo Geun's rise to Korean comedy stardom went hand in hand with his mastery over picking up social cues. Now, he's ready to share his know-hows.

(Source: Netflix)",7.4
Family Outing Season 2,Korean TV Show - 2010,17 episodes,"Family Outing Season 2 was a South Korean variety show; a part of SBS's Good Sunday lineup. It was first aired on February 21, 2010, following the end of the first season. In early episodes, a ""Family Leader"" is chosen…",7.7
Fandom Tour,Korean TV Show - 2020,16 episodes,K-pop artists have come out for fans who want to come to Korea but can't! Idol pilgrimage maker to make travel course by traveling 'instead' to hideouts containing precious memories of my favorite artist! (Source: Wikipedia),8.5
Let's Fall In Love Season 1,Chinese TV Show - 2019,12 episodes,"""Let's Fall in Love"" is a Chinese dating show, with several single men and women with different personalities who will have a week-long experience of getting to know each other, face their emotions, and getting along…",7.9
MBTI Inside,Korean TV Show - 2021,6 episodes,"This program gathers these 16 types of people, and then divides people with the same nature into the same room (such as the I introvert room / E extrovert room), compare An observational variety show with differences…",7.8
Magic Lamp,Korean TV Show - 2023,6 episodes,"A variety show where the cast leaves on a drinking trip to Montpellier, France.

(Source: MyDramaList)",8.2
NCT 127 Teach Me JAPAN: Lesson 1,Japanese TV Show - 2019,6 episodes,NCT 127 Teach Me Japan is a variety show starring NCT 127. The show is meant to give NCT 127 challenges to help them gain more popularity in Japan. It is a school based concept where the student with the worst grade…,8.4
Love after Divorce Season 3,Korean TV Show - 2022,12 episodes,"Coming back with divorced couples that are filled with charm, dating and even living together. Divorced couples that are straightforward with romance ""Love After Divorce Season 3"". (Source: Korean = Naver || Translation…",7.6
Secret Variety Training,Korean TV Show - 2017,1 episodes,"Korea’s hottest celebrities have come to the secret variety training institution hidden from the eyes of the world. Here, through the training carefully orchestrated by masters of variety shows, they will uncover their…",8.1
100-Hour Romantic Vacation – Paris et ITZY,Korean TV Show - 2020,5 episodes,"“Paris et ITZY"" will capture the journey of the five ITZY members as they explore Paris together for 100 hours.

(Source: Soompi)",8.4
Run for Time Season 3,Chinese TV Show - 2023,12 episodes,"As a street survival game, the ""player"" must evade the ""hunter"" within a certain time limit in the venue delineated by the production unit, and successfully evade the pursuit to obtain all the victory coins, while the…",8.1
ALL FOR ONE,Chinese TV Show - 2019,10 episodes,"ALL FOR ONE is a Chinese survival show by Youku. Trainees are in different classes, with the help of senior mentors, they will receive strict training. Through sweat and hard work, they will become a class of strong,…",7.6
Wanna One GO in JEJU,Korean TV Show - 2018,3 episodes,"""Wanna One GO in JEJU"" is a Korean reality show of Wanna One and is collaborated with Innisfree.",8.2
2013 Idol Star Olympics Championships Chuseok Special,Korean TV Show - 2013,2 episodes,"At the championships a total number of 10 events (7 in athletics, 2 in archery and 1 in futsal) were contested: 5 by men and 5 by women. There were a total number of 160 participating K-pop singers and celebrities, divided…",7.8
Live and Love,Chinese TV Show - 2024,20 episodes,Overview not available,7.9
Unexpected Yuh Jung,Korean TV Show - 2022,5 episodes,"Depicts Youn Yuh Jung’s everyday life in Los Angeles.

(Source: Naver)",8.1
I'm Real Song Joong Ki,Korean TV Show - 2011,2 episodes,"Join Hallyu Superstar, Song Joong Ki, as he travels to Tokyo, Japan. Discover all the wonders this great city has to offer, from shopping to food, temples to street markets, alongside one of Korea’s most beloved stars.…",7.7
Yeri's Room,Korean TV Show - 2020,24 episodes,"In a secret hideout where she’s free to let her hair down and have a little fun, Red Velvet’s Yeri has made a cozy little space all her own. Now she’s inviting all her friends to join her in her brand-new space…",8.2
Changing Majors,Korean TV Show - 2022,11 episodes,"Lee Chang Sub will be visiting various universities and experiencing various major or department.

(Source: KoreanUpdates Twitter)",8.6
Pops in Seoul,Korean TV Show - 1998,6000 episodes,A music program that showcases the hottest K-pop musicians and songs!,8.0
Astro Zone,Korean TV Show - 2021,8 episodes,"Under the theme of healing vacation, the members share their travel stories.",8.7
Laborhood on Hire,Korean TV Show - 2019,9 episodes,“Laborhood on Hire” is a show about people who meet professionally in workplaces that have a lack of employees and work hard together to put the money earned to good use. (Source: Soompi),7.8
K-pop Star Season 2,Korean TV Show - 2012,22 episodes,Survival Audition K-pop Star is a South Korean reality TV competition show where the three largest entertainment/talent agencies in Korea hold worldwide auditions to find the next potential K-Pop stars. Preliminary auditions…,7.8
GOT2DAY Season 4,Korean TV Show - 2019,21 episodes,Fourth season of GOT2DAY. A YouTube series that each member of GOT7 participate in an open talk with each of the other members.,8.6
Kep1er View,Korean TV Show - 2021,2 episodes,"Debut reality show for Kep1er, a girl group formed by the Mnet survival show, 'Girls Planet 999'. 

(Source: Netfelix at MyDramaList)",8.3
Europe Outside Your Tent: Southern France,Korean TV Show - 2024,11 episodes,"A new camping trip set in southern France. Traveling around Europe using camping sites instead of hotels, rental cars instead of trains, and local supermarkets instead of restaurants. (Source: Korean = newsis.com ||…",8.2
Invincible Youth Season 2,Korean TV Show - 2011,46 episodes,"The second season follows the same format of the first season, with different girl group members and took place in a fishing village in Daebu Island, Ansan, Gyeonggi Province.",7.6
Monsta X Is on Vacation,Korean TV Show - 2020,10 episodes,"Monsta X enjoys a 3 day 2 night vacation, filled with food, games, and relaxation.",8.7
DREAM Mystery Lab,Korean TV Show - 2021,3 episodes,Overview not available,8.7
Lipstick Prince,Chinese TV Show - 2018,10 episodes,The show features male celebrities learning about makeup and applying the techniques on female celebrities.,8.2
Run for Time Season 1,Chinese TV Show - 2015,9 episodes,"Members must complete tasks together within a certain time limit. At the same time, they are to avoid the ""hunters"" (men in black) while inside the parameters of the game. In season one, the cast is given a theme or…",8.2
Sistar and Leeteuk's Hello Baby,Korean TV Show - 2011,12 episodes,Hello Baby is South Korean reality show where celebrities experience parenthood by raising children ages 5 and under. Fourth season have a little bit changes because baby named Kim Kyumin will have moms (Sistar) and…,7.4
Go Fridge Season 6,Chinese TV Show - 2020,10 episodes,"Each episode has 2 guests and their refrigerators. The chefs will make different dishes based on what's in the fridge. The guests will then choose their favorite dish, and that team of chefs win.",8.1
